Sheet: PPVendeurs
A1: 11 | B1: Clean Cloud | C1: Simmons | D1: Alexa | E1: 2172 Bailey Drive | F1: Montréal | G1: QC | H1: N0P 2B0 | I1: CA | J1: 519-677-2931 | K1: 450-928-8504 | L1: =CONCATENATE("Vendeur"&RC[-11]&"@gmail.com") -> Vendeur11@gmail.com | M1: 1234 | N1: 450 | O1: 125 | P1: 1 | Q1: 10 | R1: 11.jpg;#4286f4;#41f4eb | S1: 2014-05-21T00:00:00.000 | T1: 2016-08-01T00:00:00.000 | U1: 1
A2: 12 | B2: Tech. Little | C2: Little | D2: Constance | E2: 1881 Bay Street | F2: Montréal | G2: QC | H2: M5J 2R8 | I2: CA | J2: 416-876-3946 | K2: 514-594-2567 | L2: =CONCATENATE("Vendeur"&RC[-11]&"@gmail.com") -> Vendeur12@gmail.com | M2: 1234 | N2: 200 | O2: 100 | P2: 1 | Q2: 15 | R2: 12.jpg;#91f441;#41f452 | S2: 2012-06-01T00:00:00.000 | T2: 2016-04-08T00:00:00.000 | U2: 1
A3: 13 | B3: McDonald Associés | C3: McDonald | D3: Florence | E3: 276 Kinchant St | F3: Longueil | G3: QC | H3: V2V 4H9 | I3: CA | J3: 450-928-8460 | K3: 450-928-3498 | L3: =CONCATENATE("Vendeur"&RC[-11]&"@gmail.com") -> Vendeur13@gmail.com | M3: 1234 | N3: 250 | O3: 75 | P3: 0 | Q3: 10 | R3: 13.jpg | S3: 2019-01-24T00:00:00.000 | T3: 2019-02-01T00:00:00.000 | U3: 0
A4: 14 | B4: Les meubles Garner | C4: Garner | D4: Peter | E4: 360 rue Saint-Charles | F4: Ottawa | G4: ON | H4: J4H 1M3 | I4: CA | J4: 450-928-4672 | K4: 438-898-6907 | L4: =CONCATENATE("Vendeur"&RC[-11]&"@gmail.com") -> Vendeur14@gmail.com | M4: 1234 | N4: 375 | O4: 150 | P4: 1 | Q4: 25 | R4: 14.jpg | S4: 2011-01-05T00:00:00.000 | T4: 2012-01-09T00:00:00.000 | U4: 1
A5: 15 | B5: TechNet Pro | C5: Fernandez | D5: John | E5: 4733 Findlay Creek Road | F5: Laval | G5: QC | H5: V0B 1M1 | I5: CA | J5: 450-928-1010 | K5: 514-757-6983 | L5: =CONCATENATE("Vendeur"&RC[-11]&"@gmail.com") -> Vendeur15@gmail.com | M5: 1234 | N5: 250 | O5: 125 | P5: 0 | Q5: 20 | R5: 15.jpg;#f441d0;#ed0e0e | S5: 2018-12-20T00:00:00.000 | T5: 2018-12-24T00:00:00.000 | U5: 0
A6: 16 | B6: Hardware and CI | C6: Read | D6: Bob | E6: 4337 Fourth Avenue | F6: Québec | G6: QC | H6: T2P 0H3 | I6: CA | J6: 450-928-8717 | K6: 514-347-7234 | L6: =CONCATENATE("Vendeur"&RC[-11]&"@gmail.com") -> Vendeur16@gmail.com | M6: 1234 | N6: 750 | O6: 275 | P6: 1 | Q6: 5 | R6: 16.jpg | S6: 2013-10-04T00:00:00.000 | T6: 2015-10-17T00:00:00.000 | U6: 1
A7: 17 | B7: SoftPro | C7: Gilbert | D7: Arman | E7: 2009 Wellington Street | F7: Fredericton | G7: NB | H7: M9C 3J5 | I7: CA | J7: 450-928-7946 | K7: 514-904-6837 | L7: =CONCATENATE("Vendeur"&RC[-11]&"@gmail.com") -> Vendeur17@gmail.com | M7: 1234 | N7: 300 | O7: 200 | P7: 1 | Q7: 10 | R7: 17.jpg | S7: 2015-03-08T00:00:00.000 | T7: 2016-08-14T00:00:00.000 | U7: 1
A8: 18 | B8: Imprimantes à bas prix | C8: Brodeur | D8: Jean-Luc | E8: 747, Saint-Germain | F8: Saint-Laurent | G8: QC | H8: H4L 3P8 | I8: CA | J8: 514-748-7872 | K8: 514-992-1092 | L8: jeanluc.brodeur@gmail.com | M8: 1234 | N8: 50 | O8: 1000 | P8: 1 | Q8: 10 | R8: NULL | S8: 2018-11-30T00:00:00.000 | T8: NULL | U8: 1
A9: 19 | B9: Vendeur1 | C9: Vendeur1 | D9: Vendeur1 | E9: NULL | F9: NULL | G9: NULL | H9: NULL | I9: NULL | J9: NULL | K9: NULL | L9: v1@gmail.com | M9: 1234 | N9: NULL | O9: NULL | P9: NULL | Q9: NULL | R9: NULL | S9: 2019-01-01T00:00:00.000 | T9: NULL | U9: 1
A10: 20 | B10: Vendeur2 | C10: Vendeur2 | D10: Vendeur2 | E10: NULL | F10: NULL | G10: NULL | H10: NULL | I10: NULL | J10: NULL | K10: NULL | L10: v2@gmail.com | M10: 1234 | N10: NULL | O10: NULL | P10: NULL | Q10: NULL | R10: NULL | S10: 2019-02-14T00:00:00.000 | T10: NULL | U10: 1

Sheet: PPClients
A1: 10001 | B1: =CONCATENATE("Client"&RC[-1]&"@gmail.com") -> Client10001@gmail.com | C1: 1234 | D1: Lawrence | E1: Sane | F1: 1175 Woodstock Drive | G1: Montréal | H1: QC | I1: H0J 4B1 | J1: CA | K1: (514)930-2302 | L1: (514)993-3232 | M1: 2015-07-11T00:00:00.000 | N1: 2016-03-12T00:00:00.000 | O1: 7 | P1: 2018-05-27T00:00:00.000 | Q1: 1
A2: 10002 | B2: =CONCATENATE("Client"&RC[-1]&"@gmail.com") -> Client10002@gmail.com | C2: 1234 | D2: Miles | E2: Sabrina | F2: 3357 Laurel Lane | G2: Québec | H2: QC | I2: H5D 1N2 | J2: CA | K2: (438)823-4214 | L2: (514)054-2342 | M2: 2017-12-02T00:00:00.000 | N2: 2018-07-23T00:00:00.000 | O2: 62 | P2: 2018-07-26T00:00:00.000 | Q2: 1
A3: 10003 | B3: =CONCATENATE("Client"&RC[-1]&"@gmail.com") -> Client10003@gmail.com | C3: 1234 | D3: NULL | E3: NULL | F3: NULL | G3: NULL | H3: NULL | I3: NULL | J3: NULL | K3: NULL | L3: NULL | M3: 2017-03-05T00:00:00.000 | N3: NULL | O3: 23 | P3: 2018-01-28T00:00:00.000 | Q3: 1
A4: 10004 | B4: =CONCATENATE("Client"&RC[-1]&"@gmail.com") -> Client10004@gmail.com | C4: 1234 | D4: Wong | E4: Aysha | F4: 1198 Mayo Street | G4: Montréal | H4: QC | I4: H5J 9P4 | J4: CA | K4: (514)041-2423 | L4: (450)132-5012 | M4: 2016-03-07T00:00:00.000 | N4: 2017-05-14T00:00:00.000 | O4: 46 | P4: 2018-02-18T00:00:00.000 | Q4: 1
A5: 10005 | B5: =CONCATENATE("Client"&RC[-1]&"@gmail.com") -> Client10005@gmail.com | C5: 1234 | D5: NULL | E5: NULL | F5: NULL | G5: NULL | H5: NULL | I5: NULL | J5: NULL | K5: NULL | L5: NULL | M5: 2013-02-15T00:00:00.000 | N5: NULL | O5: 64 | P5: 2018-06-07T00:00:00.000 | Q5: 1
A6: 10006 | B6: =CONCATENATE("Client"&RC[-1]&"@gmail.com") -> Client10006@gmail.com | C6: 1234 | D6: NULL | E6: NULL | F6: NULL | G6: NULL | H6: NULL | I6: NULL | J6: NULL | K6: NULL | L6: NULL | M6: 2016-08-16T00:00:00.000 | N6: NULL | O6: 11 | P6: 2018-01-07T00:00:00.000 | Q6: 1
A7: 10007 | B7: =CONCATENATE("Client"&RC[-1]&"@gmail.com") -> Client10007@gmail.com | C7: 1234 | D7: NULL | E7: NULL | F7: NULL | G7: NULL | H7: NULL | I7: NULL | J7: NULL | K7: NULL | L7: NULL | M7: 2019-01-17T00:00:00.000 | N7: NULL | O7: 3 | P7: 2018-12-22T00:00:00.000 | Q7: 1
A8: 10008 | B8: =CONCATENATE("Client"&RC[-1]&"@gmail.com") -> Client10008@gmail.com | C8: 1234 | D8: Cunningham | E8: Adil | F8: 2999 Berkley Street | G8: Laval | H8: QC | I8: H8D 2T4 | J8: CA | K8: (438)813-2853 | L8: (438)768-8777 | M8: 2017-04-13T00:00:00.000 | N8: 2017-09-08T00:00:00.000 | O8: 67 | P8: 2018-02-01T00:00:00.000 | Q8: 1
A9: 10009 | B9: =CONCATENATE("Client"&RC[-1]&"@gmail.com") -> Client10009@gmail.com | C9: 1234 | D9: NULL | E9: NULL | F9: NULL | G9: NULL | H9: NULL | I9: NULL | J9: NULL | K9: NULL | L9: NULL | M9: 2018-10-25T00:00:00.000 | N9: NULL | O9: 11 | P9: 2018-10-28T00:00:00.000 | Q9: 1
A10: 10010 | B10: =CONCATENATE("Client"&RC[-1]&"@gmail.com") -> Client10010@gmail.com | C10: 1234 | D10: NULL | E10: NULL | F10: NULL | G10: NULL | H10: NULL | I10: NULL | J10: NULL | K10: NULL | L10: NULL | M10: 2016-02-19T00:00:00.000 | N10: NULL | O10: 90 | P10: 2018-12-21T00:00:00.000 | Q10: 1
A11: 10011 | B11: =CONCATENATE("Client"&RC[-1]&"@gmail.com") -> Client10011@gmail.com | C11: 1234 | D11: NULL | E11: NULL | F11: NULL | G11: NULL | H11: NULL | I11: NULL | J11: NULL | K11: NULL | L11: NULL | M11: 2016-08-01T00:00:00.000 | N11: NULL | O11: 47 | P11: 2018-07-20T00:00:00.000 | Q11: 1
A12: 10012 | B12: =CONCATENATE("Client"&RC[-1]&"@gmail.com") -> Client10012@gmail.com | C12: 1234 | D12: NULL | E12: NULL | F12: NULL | G12: NULL | H12: NULL | I12: NULL | J12: NULL | K12: NULL | L12: NULL | M12: 2018-11-17T00:00:00.000 | N12: NULL | O12: 25 | P12: 2018-12-17T00:00:00.000 | Q12: 1
A13: 10013 | B13: =CONCATENATE("Client"&RC[-1]&"@gmail.com") -> Client10013@gmail.com | C13: 1234 | D13: NULL | E13: NULL | F13: NULL | G13: NULL | H13: NULL | I13: NULL | J13: NULL | K13: NULL | L13: NULL | M13: 2014-07-23T00:00:00.000 | N13: NULL | O13: 1 | P13: 2018-02-25T00:00:00.000 | Q13: 1
A14: 10014 | B14: =CONCATENATE("Client"&RC[-1]&"@gmail.com") -> Client10014@gmail.com | C14: 1234 | D14: Taylor | E14: Esther | F14: 2266 Sundown Lane | G14: Montréal | H14: QC | I14: H1T 1J5 | J14: CA | K14: (450)677-7867 | L14: (450)393-3433 | M14: 2018-01-14T00:00:00.000 | N14: 2018-11-19T00:00:00.000 | O14: 85 | P14: 2018-07-27T00:00:00.000 | Q14: 1
A15: 10015 | B15: =CONCATENATE("Client"&RC[-1]&"@gmail.com") -> Client10015@gmail.com | C15: 1234 | D15: NULL | E15: NULL | F15: NULL | G15: NULL | H15: NULL | I15: NULL | J15: NULL | K15: NULL | L15: NULL | M15: 2015-12-17T00:00:00.000 | N15: NULL | O15: 47 | P15: 2018-10-30T00:00:00.000 | Q15: 1
A16: 10016 | B16: =CONCATENATE("Client"&RC[-1]&"@gmail.com") -> Client10016@gmail.com | C16: 1234 | D16: NULL | E16: NULL | F16: NULL | G16: NULL | H16: NULL | I16: NULL | J16: NULL | K16: NULL | L16: NULL | M16: 2018-11-30T00:00:00.000 | N16: NULL | O16: 66 | P16: 2018-11-30T00:00:00.000 | Q16: 1
A17: 10017 | B17: =CONCATENATE("Client"&RC[-1]&"@gmail.com") -> Client10017@gmail.com | C17: 1234 | D17: NULL | E17: NULL | F17: NULL | G17: NULL | H17: NULL | I17: NULL | J17: NULL | K17: NULL | L17: NULL | M17: 2018-02-04T00:00:00.000 | N17: NULL | O17: 77 | P17: 2018-02-04T00:00:00.000 | Q17: 1
A18: 10018 | B18: =CONCATENATE("Client"&RC[-1]&"@gmail.com") -> Client10018@gmail.com | C18: 1234 | D18: Mann | E18: Raphaël | F18: 4651 Cottonwood Lane | G18: Montréal | H18: QC | I18: H7O 2B2 | J18: CA | K18: (514)232-9795 | L18: NULL | M18: 2017-02-15T00:00:00.000 | N18: 2017-11-24T00:00:00.000 | O18: 94 | P18: 2018-12-25T00:00:00.000 | Q18: 1
A19: 10019 | B19: =CONCATENATE("Client"&RC[-1]&"@gmail.com") -> Client10019@gmail.com | C19: 1234 | D19: Watson | E19: Joel | F19: 990 Lightning Point Drive | G19: Toronto | H19: ON | I19: H7U 2X7 | J19: CA | K19: (450)393-3433 | L19: NULL | M19: 2015-08-10T00:00:00.000 | N19: 2017-10-10T00:00:00.000 | O19: 22 | P19: 2018-09-12T00:00:00.000 | Q19: 1
A20: 10020 | B20: =CONCATENATE("Client"&RC[-1]&"@gmail.com") -> Client10020@gmail.com | C20: 1234 | D20: Osborne | E20: Tony | F20: 847 West Virginia Avenue | G20: Montréal | H20: QC | I20: H9S 7P2 | J20: CA | K20: (514)291-3043 | L20: (514)664-3214 | M20: 2017-05-21T00:00:00.000 | N20: 2017-07-28T00:00:00.000 | O20: 4 | P20: 2018-06-21T00:00:00.000 | Q20: 1
A21: 10021 | B21: hc@gmail.com | C21: 1234 | D21: Caron | E21: Hubert | F21: NULL | G21: NULL | H21: NULL | I21: NULL | J21: NULL | K21: NULL | L21: NULL | M21: 2019-02-22T00:00:00.000 | N21: NULL | O21: 1 | P21: 2019-02-22T00:00:00.000 | Q21: 1
A22: 10022 | B22: if@gmail.com | C22: 1234 | D22: Fafard | E22: Isabelle | F22: NULL | G22: NULL | H22: NULL | I22: NULL | J22: NULL | K22: NULL | L22: NULL | M22: 2019-02-22T00:00:00.000 | N22: NULL | O22: 1 | P22: 2019-02-22T00:00:00.000 | Q22: 1
A23: 10023 | B23: c1@gmail.com | C23: 1234 | D23: Client1 | E23: Client1 | F23: NULL | G23: NULL | H23: NULL | I23: NULL | J23: NULL | K23: NULL | L23: NULL | M23: 2019-02-22T00:00:00.000 | N23: NULL | O23: 1 | P23: 2019-02-22T00:00:00.000 | Q23: 1
A24: 10024 | B24: c2@gmail.com | C24: 1234 | D24: Client2 | E24: Client2 | F24: NULL | G24: NULL | H24: NULL | I24: NULL | J24: NULL | K24: NULL | L24: NULL | M24: 2019-02-22T00:00:00.000 | N24: NULL | O24: 1 | P24: 2019-02-22T00:00:00.000 | Q24: 1
A25: 10025 | B25: c3@gmail.com | C25: 1234 | D25: Client3 | E25: Client3 | F25: NULL | G25: NULL | H25: NULL | I25: NULL | J25: NULL | K25: NULL | L25: NULL | M25: 2019-02-22T00:00:00.000 | N25: NULL | O25: 1 | P25: 2019-02-22T00:00:00.000 | Q25: 1
A26: 10026 | B26: c4@gmail.com | C26: 1234 | D26: Client4 | E26: Client4 | F26: NULL | G26: NULL | H26: NULL | I26: NULL | J26: NULL | K26: NULL | L26: NULL | M26: 2019-02-22T00:00:00.000 | N26: NULL | O26: 1 | P26: 2019-02-22T00:00:00.000 | Q26: 1

Sheet: PPCategories
A1: 10 | B1: Jeux vidéos et consoles | C1: Consoles de jeux vidéos et jeux vidéos
A2: 20 | B2: Ordinateurs | C2: Ordinateurs de bureau, ordinateurs portables et accessoires
A3: 30 | B3: Moniteurs et téléviseurs | C3: Vente de moniteurs, de téléviseurs et d'équipement pour cinéma maison
A4: 40 | B4: Cellulaires | C4: Téléphones cellulaires et intelligents et accessoires
A5: 50 | B5: Articles de sport | C5: Tout l'équipement nécessaire pour améliorer ses capacités physiques
A6: 60 | B6: Livres | C6: Bibliothèque de romans, bandes dessinées et revues
A7: 70 | B7: Montres | C7: Montres en Or et Cuir, mécaniques et automatiques, pour hommes et femmes.
A8: 80 | B8: Jouets | C8: Grande variété de jouets pour enfants et adolescents

Sheet: PPProduits
A1: 1100001 | B1: 11 | C1: 10 | D1: PlayStation 4 | E1: Élégante et épurée, la console PlayStation 4 mince ouvre la porte à un monde de jeu immersif et à de divertissement supérieur. Découvrez des titres populaires présentés en HD intégrale 1080p à couper le souffle ainsi qu'une bibliothèque en ligne pleine de contenu exclusif spécialement conçu pour la PS4. | F1: =RC[-5]&".jpg" -> 1100001.jpg | G1: 399.99 | H1: 14 | I1: 1 | J1: NULL | K1: 399.99 | L1: 12 | M1: 2015-09-21T00:00:00.000 | N1: 2016-01-25T00:00:00.000
A2: 1100002 | B2: 11 | C2: 30 | D2: Télé Toshiba 32" 720p LED | E2: Un téléviseur intelligent ayant la technologie Alexa (contrôle vocal). Dimensions: 73.6 x 43.6 x 8.3 cm | F2: =RC[-5]&".jpg" -> 1100002.jpg | G2: 230 | H2: 2 | I2: 1 | J2: NULL | K2: 230 | L2: 5 | M2: 2015-06-19T00:00:00.000 | N2: 2018-11-04T00:00:00.000
A3: 1100003 | B3: 11 | C3: 30 | D3: Samsung 32 po 1080p HD LED Tizen Smart TV | E3: Une résolution 2 fois meilleure qu'un téléviseur ordinaire. Couleurs riches et de très belles textures. | F3: =RC[-5]&".jpg" -> 1100003.jpg | G3: 370 | H3: 1 | I3: 1 | J3: NULL | K3: 370 | L3: 12 | M3: 2017-05-12T00:00:00.000 | N3: 2015-07-14T00:00:00.000
A4: 1100004 | B4: 11 | C4: 30 | D4: PHILIPS 24 po CLASS 720P LED | E4: Téléviseur économique vendu partout à travers le Canada. | F4: =RC[-5]&".jpg" -> 1100004.jpg | G4: 140 | H4: 3 | I4: 1 | J4: NULL | K4: 140 | L4: 3.5 | M4: 2017-04-22T00:00:00.000 | N4: 2017-11-09T00:00:00.000
A5: 1100005 | B5: 11 | C5: 30 | D5: Samsung 65" 4K UHD HDR LED Tizen Smart TV | E5: Le meilleur téléviseur que la compagnie Clean Cloud produit. Technologie 4k, l'écran est très mince.Bref, la télé de rêve! | F5: =RC[-5]&".jpg" -> 1100005.jpg | G5: 1424.99 | H5: 2 | I5: 1 | J5: NULL | K5: 1424.99 | L5: 13 | M5: 2016-03-18T00:00:00.000 | N5: 2016-09-29T00:00:00.000
A6: 1100006 | B6: 11 | C6: 30 | D6: Moniteur Acer 27" 1080p HD 75Hz 1ms GTG TN LED | E6: Écran pour les passionné de jeux vidéos. Il est doté de la technologie AMD pour améliorer les performances | F6: =RC[-5]&".jpg" -> 1100006.jpg | G6: 286 | H6: 3 | I6: 1 | J6: NULL | K6: 286 | L6: 4.0999999999999996 | M6: 2016-09-14T00:00:00.000 | N6: 2018-08-25T00:00:00.000
A7: 1100007 | B7: 11 | C7: 40 | D7: Samsung Galaxy S7 32gb cellulaire | E7: Il est débloqué et la carte Sim n'est pas incluse. Il n'a pas la langue française. | F7: =RC[-5]&".jpg" -> 1100007.jpg | G7: 250 | H7: 3 | I7: 1 | J7: 2019-02-15T00:00:00.000 | K7: 235 | L7: 1 | M7: 2016-02-09T00:00:00.000 | N7: 2016-12-11T00:00:00.000
A8: 1100008 | B8: 11 | C8: 40 | D8: iPhone 6s 32gb GSM | E8: Il est reconditionné mais 100% fonctionnel. Très bonne qualité. | F8: =RC[-5]&".jpg" -> 1100008.jpg | G8: 480 | H8: 6 | I8: 1 | J8: 2019-03-01T00:00:00.000 | K8: 429.99 | L8: 1 | M8: 2016-12-04T00:00:00.000 | N8: 2017-02-13T00:00:00.000
A9: 1100009 | B9: 11 | C9: 40 | D9: Galaxy S8+ de 64 Go de Samsung | E9: Téléphone intelligent élégant, symétrique et très puissant | F9: =RC[-5]&".jpg" -> 1100009.jpg | G9: 799.99 | H9: 3 | I9: 1 | J9: 2019-03-11T00:00:00.000 | K9: 675.99 | L9: 1 | M9: 2016-07-15T00:00:00.000 | N9: 2016-09-23T00:00:00.000
A10: 1100010 | B10: 11 | C10: 50 | D10: Lunettes classiques | E10: Forme classique qui offre un nouveau niveau de performance. Forme très comfortable. | F10: =RC[-5]&".jpg" -> 1100010.jpg | G10: 79.989999999999995 | H10: 8 | I10: 1 | J10: NULL | K10: 79.989999999999995 | L10: 0.5 | M10: 2015-03-03T00:00:00.000 | N10: 2015-11-21T00:00:00.000
A11: 1100011 | B11: 11 | C11: 50 | D11: Lunettes Trueblue | E11: Les bords des lunettes sont flexibles et les lentilles sont teintes anti-uv. | F11: =RC[-5]&".jpg" -> 1100011.jpg | G11: 89.99 | H11: 5 | I11: 1 | J11: NULL | K11: 89.99 | L11: 0.5 | M11: 2016-11-06T00:00:00.000 | N11: 2017-03-10T00:00:00.000
A12: 1100012 | B12: 11 | C12: 50 | D12: T-shirt pour homme | E12: Chandail fit pour homme pour les activités sportives. | F12: =RC[-5]&".jpg" -> 1100012.jpg | G12: 34.99 | H12: 9 | I12: 1 | J12: NULL | K12: 34.99 | L12: 1 | M12: 2015-05-12T00:00:00.000 | N12: 2017-07-23T00:00:00.000
A13: 1100013 | B13: 11 | C13: 50 | D13: Shorts pour homme | E13: Shorts fit pour homme | F13: =RC[-5]&".jpg" -> 1100013.jpg | G13: 51.99 | H13: 2 | I13: 1 | J13: NULL | K13: 51.99 | L13: 1.2 | M13: 2017-04-04T00:00:00.000 | N13: 2019-01-01T00:00:00.000
A14: 1100014 | B14: 11 | C14: 60 | D14: Perdre du poids en mangeant du gras | E14: Cet ouvrage révise les bases de l'alimentation faible en glucides et cétogène, en plus de faire la lumière sur le jeûne intermittent. | F14: =RC[-5]&".jpg" -> 1100014.jpg | G14: 29.99 | H14: 11 | I14: 1 | J14: NULL | K14: 29.99 | L14: 2 | M14: 2017-08-20T00:00:00.000 | N14: 2017-12-10T00:00:00.000
A15: 1100015 | B15: 11 | C15: 60 | D15: Sucré sans sucre | E15: On sucre nos recettes avec des fruits et des légumes. | F15: =RC[-5]&".jpg" -> 1100015.jpg | G15: 29.95 | H15: 2 | I15: 1 | J15: NULL | K15: 29.95 | L15: 2.5 | M15: 2015-09-09T00:00:00.000 | N15: 2015-09-24T00:00:00.000
A16: 1100016 | B16: 11 | C16: 60 | D16: Dégonfler, dessouffler : être bien dans sa peau | E16: Le livre permet au lecteur de découvrir les mécanismes qui gèrent ses liens à la nourriture, d'affronter ses petits démons, de déceler d'éventuelles intolérances alimentaires et de retrouver le plaisir de manger sainement. | F16: =RC[-5]&".jpg" -> 1100016.jpg | G16: 27.49 | H16: 13 | I16: 0 | J16: NULL | K16: 27.49 | L16: 1.5 | M16: 2017-07-13T00:00:00.000 | N16: 2018-09-15T00:00:00.000
A17: 1100017 | B17: 11 | C17: 60 | D17: Sérotonine | E17: Il raconte la vie d'un ingénieur agronome et son amitié pour un aristocrate agriculteur (un inoubliable personnage de roman son double inversé), l'échec des idéaux de leur jeunesse, l'espoir peut-être insensé de retrouver une femme perdue. | F17: =RC[-5]&".jpg" -> 1100017.jpg | G17: 37.99 | H17: 8 | I17: 0 | J17: NULL | K17: 37.99 | L17: 2.7 | M17: 2015-06-06T00:00:00.000 | N17: 2017-02-02T00:00:00.000
A18: 1100018 | B18: 11 | C18: 60 | D18: Félix et la source invisible | E18: Félix, 12 ans vit un cauchemar. Sa mère Fatou, une magnifique Sénégalaise qui tient un petit café à Belleville est entrée dans une dépression profonde. | F18: =RC[-5]&".jpg" -> 1100018.jpg | G18: 24.99 | H18: 2 | I18: 1 | J18: NULL | K18: 24.99 | L18: 2.9 | M18: 2015-06-10T00:00:00.000 | N18: 2017-05-09T00:00:00.000
A19: 1100019 | B19: 11 | C19: 60 | D19: Tous nos jours parfaits | E19: Theodore Finch est un jeune homme perturbé, alternant les phases d'accablement avec les moments de grande euphorie. | F19: =RC[-5]&".jpg" -> 1100019.jpg | G19: 14.99 | H19: 4 | I19: 1 | J19: NULL | K19: 14.99 | L19: 3.2 | M19: 2016-05-08T00:00:00.000 | N19: 2019-01-10T00:00:00.000
A20: 1100020 | B20: 11 | C20: 60 | D20: Aimer, enseigner | E20: Après trente-cinq ans d’enseignement de la littérature, Yvon Rivard réfléchit sur ce métier, qui est idéalement un métier de partage et d’éveil du désir. | F20: =RC[-5]&".jpg" -> 1100020.jpg | G20: 45 | H20: 6 | I20: 1 | J20: NULL | K20: 45 | L20: 3.4 | M20: 2016-06-10T00:00:00.000 | N20: 2017-07-25T00:00:00.000
A21: 1100021 | B21: 11 | C21: 60 | D21: Les Derniers jours de l'émerveillement | E21: Paul Cravath, un jeune avocat, aidé par le célèbre Nikola Tesla, se mêle au combat et découvre bientôt les intentions cachées de chacun des belligérants. | F21: =RC[-5]&".jpg" -> 1100021.jpg | G21: 41.25 | H21: 2 | I21: 1 | J21: NULL | K21: 41.25 | L21: 2.2999999999999998 | M21: 2017-06-03T00:00:00.000 | N21: 2017-12-06T00:00:00.000
A22: 1100022 | B22: 11 | C22: 60 | D22: Vingt-trois secrets bien gardés | E22: Inépuisable conteur, Michel Tremblay n’a pu résister au plaisir d’offrir à ses fidèles lecteurs un petit bouquet de souvenirs et d’amitiés. Son immense et infaillible mémoire affective – l’insigne intelligence du cœur – colore ces vingt-trois courts métrages, instants d’épiphanies qu’il revoit sur l’écran de sa vie. | F22: =RC[-5]&".jpg" -> 1100022.jpg | G22: 39.99 | H22: 5 | I22: 1 | J22: NULL | K22: 39.99 | L22: 1.6 | M22: 2017-11-05T00:00:00.000 | N22: 2018-03-15T00:00:00.000
A23: 1100023 | B23: 11 | C23: 60 | D23: Pressentiments | E23: En vacances avec son mari et son fils, Julia est victime d'un accident qui la transporte dans un état intermédiaire entre rêve et réalité, un univers irréel et familier à la fois, où seul son instinct de survie peut lui faire rencontrer les personnes qu'elle aime. | F23: =RC[-5]&".jpg" -> 1100023.jpg | G23: 37.29 | H23: 12 | I23: 1 | J23: NULL | K23: 37.29 | L23: 3.6 | M23: 2016-03-02T00:00:00.000 | N23: 2017-01-05T00:00:00.000
A24: 1100024 | B24: 11 | C24: 60 | D24: Ta deuxième vie commence | E24: Camille, trente-huit ans et quart, a tout, semble-t-il, pour être heureuse. | F24: =RC[-5]&".jpg" -> 1100024.jpg | G24: 46.28 | H24: 4 | I24: 1 | J24: NULL | K24: 46.28 | L24: 4.2 | M24: 2016-06-25T00:00:00.000 | N24: 2018-07-10T00:00:00.000
A25: 1100025 | B25: 11 | C25: 60 | D25: La Servante écarlate 3e éd. | E25: Alors que la natalité ne cesse de baisser, Defred doit mettre au service de la république de Giléad, récemment fondée par des fanatiques religieux, son attribut le plus précieux : sa matrice. | F25: =RC[-5]&".jpg" -> 1100025.jpg | G25: 22.98 | H25: 5 | I25: 1 | J25: NULL | K25: 22.98 | L25: 2.7 | M25: 2015-06-30T00:00:00.000 | N25: 2015-07-24T00:00:00.000
A26: 1100026 | B26: 11 | C26: 60 | D26: La Vérité sur l'affaire Harry Quebert | E26: Un jeune écrivain à succès vient en aide à son ami Harry Quebert, inculpé pour le meurtre d'une jeune fille de 15 ans. | F26: =RC[-5]&".jpg" -> 1100026.jpg | G26: 30.99 | H26: 13 | I26: 1 | J26: NULL | K26: 30.99 | L26: 2.5 | M26: 2016-12-04T00:00:00.000 | N26: 2017-03-28T00:00:00.000
A27: 1100027 | B27: 11 | C27: 60 | D27: Sans toi | E27: En 1984, dans le Suffolk, Eva disparaît en mer. Le couple que forment ses parents explose tandis que sa soeur, Faith, refuse de croire à sa mort. Au large des côtes, une île parsemée de blockhaus semble hors d'atteinte. C'est là qu'Eva est retenue prisonnière. | F27: =RC[-5]&".jpg" -> 1100027.jpg | G27: 45.27 | H27: 9 | I27: 1 | J27: NULL | K27: 45.27 | L27: 5 | M27: 2016-09-27T00:00:00.000 | N27: 2018-04-12T00:00:00.000
A28: 1100028 | B28: 11 | C28: 70 | D28: La montre Grant acier inoxydable | E28: Une montre élégante avec une pointe d'inspiration athlétique pour l'homme actif | F28: =RC[-5]&".jpg" -> 1100028.jpg | G28: 185 | H28: 9 | I28: 1 | J28: NULL | K28: 185 | L28: 1.4 | M28: 2017-03-11T00:00:00.000 | N28: 2018-12-27T00:00:00.000
A29: 1100029 | B29: 11 | C29: 70 | D29: La montre minimaliste | E29: Une montre épurée et minimaliste avec son look monochrome qui vous suivra au quotidien | F29: =RC[-5]&".jpg" -> 1100029.jpg | G29: 385 | H29: 11 | I29: 1 | J29: NULL | K29: 385 | L29: 0.7 | M29: 2016-05-09T00:00:00.000 | N29: 2017-03-28T00:00:00.000
A30: 1100030 | B30: 11 | C30: 70 | D30: La montre Ralph or rose | E30: Une montre élégante au style vintage avec chiffres romains et accents au fini or rose | F30: =RC[-5]&".jpg" -> 1100030.jpg | G30: 265 | H30: 12 | I30: 1 | J30: NULL | K30: 265 | L30: 1.3 | M30: 2014-11-24T00:00:00.000 | N30: 2016-05-07T00:00:00.000
A31: 1100031 | B31: 11 | C31: 80 | D31: Trotinette | E31: Une trotinette qui peut mener loin. Il est possible de l'utiliser pour faire des sauts! | F31: =RC[-5]&".jpg" -> 1100031.jpg | G31: 87 | H31: 8 | I31: 1 | J31: NULL | K31: 87 | L31: 23 | M31: 2016-05-01T00:00:00.000 | N31: 2017-05-26T00:00:00.000
A32: 1100032 | B32: 11 | C32: 80 | D32: Planche Cruizer | E32: Une planche à roulette conçue pour les plus longues distances | F32: =RC[-5]&".jpg" -> 1100032.jpg | G32: 129.99 | H32: 1 | I32: 1 | J32: NULL | K32: 129.99 | L32: 7.5 | M32: 2016-01-18T00:00:00.000 | N32: 2016-10-28T00:00:00.000
A33: 1200001 | B33: 12 | C33: 20 | D33: MacBook Air 13,3 po d'Apple | E33: Core i5 à 1,8 GHz d'Intel/SSD de 256 Go/RAM 8 Go | F33: =RC[-5]&".jpg" -> 1200001.jpg | G33: 1250.99 | H33: 3 | I33: 1 | J33: NULL | K33: 1250.99 | L33: 3.3 | M33: 2013-04-18T00:00:00.000 | N33: 2013-05-14T00:00:00.000
A34: 1200002 | B34: 12 | C34: 20 | D34: Portable MacBook Pro 13,3 po Apple | E34: Core i5 2,3 GHz Intel/SSD 128 Go/RAM 8 Go | F34: =RC[-5]&".jpg" -> 1200002.jpg | G34: 1740 | H34: 2 | I34: 1 | J34: NULL | K34: 1740 | L34: 5.0999999999999996 | M34: 2017-05-15T00:00:00.000 | N34: 2017-10-27T00:00:00.000
A35: 1200003 | B35: 12 | C35: 20 | D35: MacBook Air 13,3 po Apple écran Retina | E35: Core i5 1,6 GHz Intel/SSD 128 Go/RAM 8 Go | F35: =RC[-5]&".jpg" -> 1200003.jpg | G35: 1500 | H35: 3 | I35: 1 | J35: NULL | K35: 1500 | L35: 4.3 | M35: 2016-06-29T00:00:00.000 | N35: 2016-12-28T00:00:00.000
A36: 1200004 | B36: 12 | C36: 20 | D36: Ord. Pavilion de HP | E36: Une tour ayant les specs: Core i5-8400 Intel/DD 1 To/SSD 128 Go/RAM 8 Go et Windows 10 | F36: =RC[-5]&".jpg" -> 1200004.jpg | G36: 701.1 | H36: 2 | I36: 1 | J36: NULL | K36: 701.1 | L36: 21.3 | M36: 2013-10-17T00:00:00.000 | N36: 2014-03-26T00:00:00.000
A37: 1200005 | B37: 12 | C37: 20 | D37: Aurora d'Alienware | E37: Une tour ayant les specs: i7-8700 d'Intel/DD 1 To/Optane 16 Go/RAM 16 Go/GeForce GTX1060 de NVIDIA et Windows 10 | F37: =RC[-5]&".jpg" -> 1200005.jpg | G37: 2001.1 | H37: 1 | I37: 0 | J37: NULL | K37: 2001.1 | L37: 37.67 | M37: 2013-04-06T00:00:00.000 | N37: 2017-08-16T00:00:00.000
A38: 1200006 | B38: 12 | C38: 20 | D38: Ordi tout-en-un Pavilion HP | E38: Tout en un qui a quadruple cœur,mém vive 8 Go,Radeon R5 et Windows 10 | F38: =RC[-5]&".jpg" -> 1200006.jpg | G38: 755.5 | H38: 4 | I38: 1 | J38: NULL | K38: 755.5 | L38: 17.2 | M38: 2016-01-11T00:00:00.000 | N38: 2016-01-28T00:00:00.000
A39: 1200007 | B39: 12 | C39: 20 | D39: Apple iMac A1224, 20 po | E39: Intel Core 2 Due, 4GB RAM, 160GB HDD, OS X El Capitan | F39: =RC[-5]&".jpg" -> 1200007.jpg | G39: 235 | H39: 1 | I39: 1 | J39: NULL | K39: 235 | L39: 42.7 | M39: 2015-04-03T00:00:00.000 | N39: 2018-11-13T00:00:00.000
A40: 1200008 | B40: 12 | C40: 20 | D40: HP 6305 | E40: Une tour ayant les specs: AMD 3.4 GHz 4GB RAM 250GB HDD DVD | F40: =RC[-5]&".jpg" -> 1200008.jpg | G40: 99.99 | H40: 1 | I40: 1 | J40: NULL | K40: 99.99 | L40: 26.5 | M40: 2016-03-13T00:00:00.000 | N40: 2016-03-29T00:00:00.000
A41: 1200009 | B41: 12 | C41: 20 | D41: Chromebook C202SA 11,6 po d'ASUS | E41: Pour les étudiants! Celeron N3060 d'Intel/DD 16 Go/RAM 2 Go/Chrome | F41: =RC[-5]&".jpg" -> 1200009.jpg | G41: 180.99 | H41: 7 | I41: 1 | J41: NULL | K41: 180.99 | L41: 4.2 | M41: 2015-12-12T00:00:00.000 | N41: 2016-01-17T00:00:00.000
A42: 1200010 | B42: 12 | C42: 20 | D42: HP Celeron N2840 | E42: Il a 11 po, 16go de disque dur, 4g de ram. C'est un petit laptop qui sert à naviguer enligne et écrire des documents | F42: =RC[-5]&".jpg" -> 1200010.jpg | G42: 125.99 | H42: 6 | I42: 1 | J42: NULL | K42: 125.99 | L42: 9.6999999999999993 | M42: 2015-02-26T00:00:00.000 | N42: 2017-09-14T00:00:00.000
A43: 1200011 | B43: 12 | C43: 20 | D43: Ensemble avec clavier et souris optique | E43: Clavier et souris sans fil qui offre une très bonne autonomie d'énergie | F43: =RC[-5]&".jpg" -> 1200011.jpg | G43: 39.99 | H43: 11 | I43: 1 | J43: NULL | K43: 39.99 | L43: 1.1000000000000001 | M43: 2017-11-17T00:00:00.000 | N43: 2018-01-24T00:00:00.000
A44: 1200012 | B44: 12 | C44: 20 | D44: Clavier Cherry MX K70 | E44: Clavier de jeu mécanique rétroéclairé. Un bruit de clic qui résonne. | F44: =RC[-5]&".jpg" -> 1200012.jpg | G44: 209.99 | H44: 3 | I44: 1 | J44: NULL | K44: 209.99 | L44: 1 | M44: 2016-10-18T00:00:00.000 | N44: 2017-03-13T00:00:00.000
A45: 1200013 | B45: 12 | C45: 50 | D45: Pull chandaille manches longues zippé | E45: Chandail utile lorsqu'il fait un peu froid dehors. Il garde le corps chaud tout en dégageant l'humidité. | F45: =RC[-5]&".jpg" -> 1200013.jpg | G45: 104 | H45: 17 | I45: 1 | J45: NULL | K45: 104 | L45: 2.5 | M45: 2015-03-03T00:00:00.000 | N45: 2015-04-26T00:00:00.000
A46: 1400001 | B46: 14 | C46: 10 | D46: Call of Duty Black Ops 4 | E46: Jeu FPS en mode solo, multijoueur ou le monde zombie. Vient avec le mode Battle Royale! | F46: =RC[-5]&".jpg" -> 1400001.jpg | G46: 79.989999999999995 | H46: 5 | I46: 1 | J46: NULL | K46: 79.989999999999995 | L46: 0.5 | M46: 2013-08-17T00:00:00.000 | N46: 2018-10-25T00:00:00.000
A47: 1400002 | B47: 14 | C47: 10 | D47: Assassin's Creed Odyssey | E47: Dans la scène de la Grèce antique, découvrer un héros assassin puissant et destructeur. | F47: =RC[-5]&".jpg" -> 1400002.jpg | G47: 39.99 | H47: 3 | I47: 1 | J47: NULL | K47: 39.99 | L47: 0.5 | M47: 2014-09-19T00:00:00.000 | N47: 2016-01-26T00:00:00.000
A48: 1400003 | B48: 14 | C48: 20 | D48: Souris de jeu optique | E48: Souris sans fil G900 Chaos Spectrum de Logitech qui a un taux de rapport de 1 ms. | F48: =RC[-5]&".jpg" -> 1400003.jpg | G48: 180 | H48: 5 | I48: 1 | J48: NULL | K48: 180 | L48: 0.5 | M48: 2012-07-13T00:00:00.000 | N48: 2015-06-18T00:00:00.000
A49: 1400004 | B49: 14 | C49: 40 | D49: Galaxy A5 de 32 Go de Samsung | E49: Téléphone intelligent avec une caméra arrière et avant. | F49: =RC[-5]&".jpg" -> 1400004.jpg | G49: 349.99 | H49: 2 | I49: 1 | J49: NULL | K49: 349.99 | L49: 1 | M49: 2015-08-22T00:00:00.000 | N49: 2015-10-09T00:00:00.000
A50: 1400005 | B50: 14 | C50: 40 | D50: Apple iPhone 8, 64GB | E50: Une des versions du Iphone les plus récentes. Rapide, efficace et propose de très belles couleurs | F50: =RC[-5]&".jpg" -> 1400005.jpg | G50: 799.99 | H50: 6 | I50: 1 | J50: NULL | K50: 799.99 | L50: 1 | M50: 2014-07-12T00:00:00.000 | N50: 2014-11-27T00:00:00.000
A51: 1400006 | B51: 14 | C51: 40 | D51: ZenFone Live L1 d'ASUS | E51: Navigation facile avec ce tout nouveau téléphone intelligent. Bonne batterie. | F51: =RC[-5]&".jpg" -> 1400006.jpg | G51: 170 | H51: 0 | I51: 1 | J51: NULL | K51: 170 | L51: 1 | M51: 2011-01-11T00:00:00.000 | N51: 2014-05-25T00:00:00.000
A52: 1400007 | B52: 14 | C52: 40 | D52: Nokia 1 | E52: Abordez les messages texte, les appels et la navigation sans effort avec le Nokia 1. | F52: =RC[-5]&".jpg" -> 1400007.jpg | G52: 129.99 | H52: 4 | I52: 1 | J52: NULL | K52: 129.99 | L52: 1 | M52: 2011-11-24T00:00:00.000 | N52: 2017-02-26T00:00:00.000
A53: 1400008 | B53: 14 | C53: 50 | D53: Leggings pour femme | E53: Leggings fit pour femmes. Le tissue est synthétique et élastique. | F53: =RC[-5]&".jpg" -> 1400008.jpg | G53: 79.989999999999995 | H53: 8 | I53: 1 | J53: NULL | K53: 79.989999999999995 | L53: 1.9 | M53: 2012-09-22T00:00:00.000 | N53: 2016-02-20T00:00:00.000
A54: 1400009 | B54: 14 | C54: 50 | D54: T-shirt pour femme | E54: Chandail fit pour femme pour les activités sportives. | F54: =RC[-5]&".jpg" -> 1400009.jpg | G54: 49.99 | H54: 2 | I54: 1 | J54: NULL | K54: 49.99 | L54: 2.7 | M54: 2014-07-12T00:00:00.000 | N54: 2015-03-19T00:00:00.000
A55: 1400010 | B55: 14 | C55: 60 | D55: Sauvons les arcs-en-ciel | E55: Luna-Belle est la plus heureuse des enfants depuis qu'elle a rencontré Céleste, son amie LICORNE. Mais un jour, un vent de panique s'empare d'elle : les COULEURS sont en train de DISPARAÎTRE ! | F55: =RC[-5]&".jpg" -> 1400010.jpg | G55: 42.47 | H55: 1 | I55: 1 | J55: NULL | K55: 42.47 | L55: 5.4 | M55: 2012-12-01T00:00:00.000 | N55: 2016-01-23T00:00:00.000
A56: 1400011 | B56: 14 | C56: 60 | D56: Des papillons dans le ventre #01 | E56: Elle est timide, réservée et ne se confie pas facilement.Qui est-elle ? Maëlie Pour tout connaître d'elle, tu n'as qu'à suivre sa chaîne : Les DIY de Maëlie ! | F56: =RC[-5]&".jpg" -> 1400011.jpg | G56: 15.75 | H56: 12 | I56: 1 | J56: NULL | K56: 15.75 | L56: 4.7 | M56: 2013-08-02T00:00:00.000 | N56: 2013-08-04T00:00:00.000
A57: 1400012 | B57: 14 | C57: 60 | D57: Ex, drague et rock'n'roll ! | E57: Malgré la célébrité et les foules en délire, la vie de vedette n'est pas de tout repos pour Karine. | F57: =RC[-5]&".jpg" -> 1400012.jpg | G57: 29.26 | H57: 7 | I57: 1 | J57: NULL | K57: 29.26 | L57: 4.3 | M57: 2011-11-25T00:00:00.000 | N57: 2014-08-01T00:00:00.000
A58: 1400013 | B58: 14 | C58: 60 | D58: Les légendaires | E58: Un étrange phénomène appelé le néant menace le monde elfique. Shimy aide les elfes à sauver Astria grâce à ses pouvoirs élémentaires naissants. | F58: =RC[-5]&".jpg" -> 1400013.jpg | G58: 54.17 | H58: 6 | I58: 1 | J58: NULL | K58: 54.17 | L58: 4.7 | M58: 2015-06-08T00:00:00.000 | N58: 2016-07-25T00:00:00.000
A59: 1400014 | B59: 14 | C59: 80 | D59: Casque pour jeune | E59: Casque de sécurité pour jeune. Il est très résistant aux chocs et a été testé à de multiples reprises. | F59: =RC[-5]&".jpg" -> 1400014.jpg | G59: 55 | H59: 8 | I59: 1 | J59: NULL | K59: 55 | L59: 5.3 | M59: 2013-07-08T00:00:00.000 | N59: 2017-04-26T00:00:00.000
A60: 1400015 | B60: 14 | C60: 80 | D60: LEGO Star Wars L'Étoile de la Mort | E60: Avec plus de 4 000 pièces, ce modèle génial a une galaxie d'environnements élaborés et authentiques, notamment une salle de contrôle superlaser, une salle de conférence impériale et un hangar avec une rampe de lancement. | F60: =RC[-5]&".jpg" -> 1400015.jpg | G60: 599.99 | H60: 4 | I60: 1 | J60: NULL | K60: 599.99 | L60: 15 | M60: 2012-08-04T00:00:00.000 | N60: 2018-01-14T00:00:00.000
A61: 1400016 | B61: 14 | C61: 80 | D61: Monopoly : édition Fortnite | E61: Dans l''édition Fortnite du jeu Monopoly, les joueurs doivent s''emparer de différents lieux, combattre leurs adversaires et éviter la tempête pour survivre. | F61: =RC[-5]&".jpg" -> 1400016.jpg | G61: 24.99 | H61: 2 | I61: 1 | J61: NULL | K61: 24.99 | L61: 7 | M61: 2014-10-18T00:00:00.000 | N61: 2016-01-27T00:00:00.000
A62: 1400017 | B62: 14 | C62: 80 | D62: LEGO Creator - Le Pont de Londres | E62: Le célèbre pont de Londres en Angleterre, qui s'élance au dessus de la Tamise depuis 1894, est l'un des monuments les plus connus au monde. Tu peux maintenant ajouter ce classique intemporel à ta collection de bâtiments LEGO ! | F62: =RC[-5]&".jpg" -> 1400017.jpg | G62: 299.99 | H62: 2 | I62: 1 | J62: NULL | K62: 299.99 | L62: 8.75 | M62: 2011-05-13T00:00:00.000 | N62: 2015-11-21T00:00:00.000
A63: 1400018 | B63: 14 | C63: 80 | D63: Système de karaoké portatif à lumières | E63: Le système de karaoké de série Singing Machine Classic lemporte sur les autres systèmes de karaoké en jouant vous morceaux de musique préférés dans un ensemble léger. | F63: =RC[-5]&".jpg" -> 1400018.jpg | G63: 99.99 | H63: 7 | I63: 1 | J63: NULL | K63: 99.99 | L63: 5 | M63: 2013-09-10T00:00:00.000 | N63: 2017-01-21T00:00:00.000
A64: 1400019 | B64: 14 | C64: 80 | D64: Guitare électrique Viper de Bridgecraft en érable | E64: La Viper de Bguitars est un design original conçu à partir de composants et de caractéristiques utilisés dans de nombreuses guitares de haute qualité. | F64: =RC[-5]&".jpg" -> 1400019.jpg | G64: 175 | H64: 6 | I64: 0 | J64: NULL | K64: 175 | L64: 14.5 | M64: 2011-06-03T00:00:00.000 | N64: 2011-10-09T00:00:00.000
A65: 1600001 | B65: 16 | C65: 10 | D65: FIFA 19 | E65: Jeu de EA SPORTS, il offre des graphiques supers et innovants qui redéfinit la manière de jouer à FIFA | F65: =RC[-5]&".jpg" -> 1600001.jpg | G65: 39.99 | H65: 1 | I65: 1 | J65: 2019-01-24T00:00:00.000 | K65: 24.99 | L65: 0.5 | M65: 2015-08-13T00:00:00.000 | N65: 2015-11-10T00:00:00.000
A66: 1600002 | B66: 16 | C66: 10 | D66: Resident Evil 2 | E66: Réédition du jeu classique d'horreur et d'action. | F66: =RC[-5]&".jpg" -> 1600002.jpg | G66: 79.989999999999995 | H66: 4 | I66: 1 | J66: 2019-01-14T00:00:00.000 | K66: 69.989999999999995 | L66: 0.5 | M66: 2016-05-05T00:00:00.000 | N66: 2017-01-01T00:00:00.000
A67: 1600003 | B67: 16 | C67: 10 | D67: Red Dead Redemption 2 | E67: Développé par les créateurs de Grand Theft Auto V et de Red Dead Redemption, Red Dead Redemption 2 pour PlayStation 4 raconte une histoire épique au coeur de l'Amérique à l'aube de l'ère moderne. | F67: =RC[-5]&".jpg" -> 1600003.jpg | G67: 79.989999999999995 | H67: 3 | I67: 1 | J67: 2019-02-17T00:00:00.000 | K67: 39.99 | L67: 0.5 | M67: 2016-10-18T00:00:00.000 | N67: 2018-09-11T00:00:00.000
A68: 1600004 | B68: 16 | C68: 10 | D68: Kingdom Hearts 3 | E68: Établi dans des mondes variés de Disney et Pixar, Sora découvre qu'il est l'héritier d'un pouvoir spectaculaire. Donald et Dingo se joignent à lui alors qu'il se bat pour empêcher les maléfiques Sans-Coeur d'envahir et de s'emparer de l'univers. | F68: =RC[-5]&".jpg" -> 1600004.jpg | G68: 79.989999999999995 | H68: 6 | I68: 1 | J68: 2019-01-27T00:00:00.000 | K68: 73.989999999999995 | L68: 0.5 | M68: 2014-07-15T00:00:00.000 | N68: 2015-06-24T00:00:00.000
A69: 1600005 | B69: 16 | C69: 10 | D69: Battlefield V | E69: Jeu qui se passe durant la Deuxième Guerre mondiale. FPS controversal | F69: =RC[-5]&".jpg" -> 1600005.jpg | G69: 49.99 | H69: 2 | I69: 1 | J69: 2019-02-21T00:00:00.000 | K69: 35.99 | L69: 0.5 | M69: 2017-12-27T00:00:00.000 | N69: 2018-09-07T00:00:00.000
A70: 1600006 | B70: 16 | C70: 10 | D70: Anthem | E70: Les Freelancer sont les seuls qui se dressent entre ces forces ténébreuses et l'ancienne technologie qu'elles convoitent. Explorez et combatez pour la survie de l'humanité! | F70: =RC[-5]&".jpg" -> 1600006.jpg | G70: 79.989999999999995 | H70: 4 | I70: 1 | J70: 2019-02-27T00:00:00.000 | K70: 64.989999999999995 | L70: 0.5 | M70: 2016-08-07T00:00:00.000 | N70: 2017-10-08T00:00:00.000
A71: 1600007 | B71: 16 | C71: 10 | D71: Minecraft | E71: Créez! Construisez! Explorez! | F71: =RC[-5]&".jpg" -> 1600007.jpg | G71: 49.99 | H71: 2 | I71: 1 | J71: 2019-03-04T00:00:00.000 | K71: 27.99 | L71: 0.5 | M71: 2014-01-16T00:00:00.000 | N71: 2016-12-26T00:00:00.000
A72: 1600008 | B72: 16 | C72: 20 | D72: Boîtier d'alimentation ATX de 600 W TR2 | E72: Le boitier qu'il vous faut! Il offre une alimentation fiable et musclée | F72: =RC[-5]&".jpg" -> 1600008.jpg | G72: 79.989999999999995 | H72: 3 | I72: 1 | J72: NULL | K72: 79.989999999999995 | L72: 2.9 | M72: 2017-09-29T00:00:00.000 | N72: 2017-11-13T00:00:00.000
A73: 1600009 | B73: 16 | C73: 20 | D73: Boîtier d'alimentation ATX de 600 W | E73: Boitier qui donne toute l'énergie nécessaire pour faire fonctionner l'ordinateur. | F73: =RC[-5]&".jpg" -> 1600009.jpg | G73: 50.19 | H73: 2 | I73: 1 | J73: NULL | K73: 50.19 | L73: 2.6 | M73: 2014-08-29T00:00:00.000 | N73: 2016-02-17T00:00:00.000
A74: 1600010 | B74: 16 | C74: 20 | D74: Système de haut-parleurs multimédia Companion | E74: Super système qui offre un son riche et clair. Facile d'utilisation grâce à son unité de commande unique. | F74: =RC[-5]&".jpg" -> 1600010.jpg | G74: 260.5 | H74: 4 | I74: 1 | J74: NULL | K74: 260.5 | L74: 15 | M74: 2014-05-03T00:00:00.000 | N74: 2016-03-06T00:00:00.000
A75: 1600011 | B75: 16 | C75: 20 | D75: Haut-parleurs série Studio | E75: Super Système R1280T d'Edifier offrant une bonne porté de son dynamique. | F75: =RC[-5]&".jpg" -> 1600011.jpg | G75: 130 | H75: 2 | I75: 1 | J75: NULL | K75: 130 | L75: 31 | M75: 2016-03-11T00:00:00.000 | N75: 2018-09-29T00:00:00.000
A76: 1600012 | B76: 16 | C76: 20 | D76: Tapis de souris de jeu en tissu anti-effilochage | E76: Le tapis comporte une surface en tissu tissé offrant un suivi précis pour vos jeux. Sa bordure cousue résiste à l'effilochage. | F76: =RC[-5]&".jpg" -> 1600012.jpg | G76: 24 | H76: 5 | I76: 1 | J76: NULL | K76: 24 | L76: 0.1 | M76: 2014-06-19T00:00:00.000 | N76: 2015-04-28T00:00:00.000
A77: 1600013 | B77: 16 | C77: 20 | D77: Casque de jeu sans fil ManO'War de Razer | E77: Une des meilleures paires de Razor. Produit un son riche et réaliste. Comprend un micro | F77: =RC[-5]&".jpg" -> 1600013.jpg | G77: 150 | H77: 9 | I77: 1 | J77: NULL | K77: 150 | L77: 2.1 | M77: 2015-08-09T00:00:00.000 | N77: 2015-02-26T00:00:00.000
A78: 1600014 | B78: 16 | C78: 30 | D78: Moniteur DEL TN 60 Hz de 20,7 po d'Acer | E78: Permet à l'utilisateur de travailler, jouer et regarder des vidéos en HD intégrale. | F78: =RC[-5]&".jpg" -> 1600014.jpg | G78: 105 | H78: 5 | I78: 1 | J78: NULL | K78: 105 | L78: 3.5 | M78: 2015-05-17T00:00:00.000 | N78: 2017-01-10T00:00:00.000
A79: 1600015 | B79: 16 | C79: 30 | D79: Moniteur Acer V196HQL Ab 18.5 po LED | E79: Petit écran pour utilisateur d'occasion | F79: =RC[-5]&".jpg" -> 1600015.jpg | G79: 76 | H79: 2 | I79: 1 | J79: NULL | K79: 76 | L79: 3.7 | M79: 2016-08-25T00:00:00.000 | N79: 2017-04-13T00:00:00.000
A80: 1600016 | B80: 16 | C80: 30 | D80: Moniteur de jeu DEL HD intégrale Samsung | E80: Ce moniteur permet de performer dans les jeux vidéos. C'est la pièce maîtresse de votre arsenal de jeu! | F80: =RC[-5]&".jpg" -> 1600016.jpg | G80: 178 | H80: 1 | I80: 1 | J80: NULL | K80: 178 | L80: 2.8 | M80: 2017-06-09T00:00:00.000 | N80: 2017-12-17T00:00:00.000
A81: 1600017 | B81: 16 | C81: 30 | D81: Moniteur DEL VA 60 Hz de 21,5 po de BENQ | E81: Le temps de réponse est de 5 ms. Vendu à travers l'Europe et maintenant l'Amérique du Nord. | F81: =RC[-5]&".jpg" -> 1600017.jpg | G81: 118 | H81: 6 | I81: 1 | J81: NULL | K81: 118 | L81: 3.4 | M81: 2017-06-12T00:00:00.000 | N81: 2018-07-16T00:00:00.000
A82: 1600018 | B82: 16 | C82: 40 | D82: Galaxy J3 de 16 Go de Samsung | E82: Conçu pour performer, le Galaxy J3 de Samsung est doté d'un écran HD de 5 po, d'une longue autonomie, d'une caméra arrière de 8 Mpx et du système d'exploitation Android Oreo. | F82: =RC[-5]&".jpg" -> 1600018.jpg | G82: 189.99 | H82: 9 | I82: 1 | J82: NULL | K82: 189.99 | L82: 1 | M82: 2016-04-26T00:00:00.000 | N82: 2017-03-01T00:00:00.000
A83: 1600019 | B83: 16 | C83: 40 | D83: ROG de 128 Go d'Asus | E83: Doté d'un processeur octocoeur de 2,8 GHz et de 8 Go de mémoire vive, il prend aisément en charge les jeux et les applications exigeantes en ressources. | F83: =RC[-5]&".jpg" -> 1600019.jpg | G83: 1199.99 | H83: 3 | I83: 1 | J83: NULL | K83: 1199.99 | L83: 1 | M83: 2015-06-06T00:00:00.000 | N83: 2017-11-28T00:00:00.000
A84: 1600020 | B84: 16 | C84: 40 | D84: iPhone XR de 64 Go d'Apple | E84: Tout nouveau cellulaire Apple. Tout nouvel écran Liquid Retina : l'écran ACL le plus raffiné de l'industrie. | F84: =RC[-5]&".jpg" -> 1600020.jpg | G84: 899.99 | H84: 2 | I84: 1 | J84: NULL | K84: 899.99 | L84: 1 | M84: 2015-04-07T00:00:00.000 | N84: 2017-07-20T00:00:00.000
A85: 1600021 | B85: 16 | C85: 40 | D85: G4 de 32 Go de LG | E85: Son éblouissant écran de 5,5 po produit des images magnifiques, tandis que sa caméra de 16 Mpx assure une qualité d'image plus vraie que nature. | F85: =RC[-5]&".jpg" -> 1600021.jpg | G85: 109.99 | H85: 6 | I85: 1 | J85: NULL | K85: 109.99 | L85: 1 | M85: 2015-10-29T00:00:00.000 | N85: 2017-09-23T00:00:00.000
A86: 1600022 | B86: 16 | C86: 40 | D86: Razer 64 Go | E86: Découvrez les graphiques les plus fluides et le son de qualité cinématographique avec ce téléphone cellulaire Razer déverrouillé. | F86: =RC[-5]&".jpg" -> 1600022.jpg | G86: 499.99 | H86: 6 | I86: 1 | J86: NULL | K86: 499.99 | L86: 1 | M86: 2016-03-25T00:00:00.000 | N86: 2017-11-21T00:00:00.000
A87: 1600023 | B87: 16 | C87: 40 | D87: Samsung Galaxy Note 9 | E87: Le tout nouveau cellulaire de Samsung offre une qualité d'écran hors-pair et vient avec un stylo qui assure une parfaite précision. | F87: =RC[-5]&".jpg" -> 1600023.jpg | G87: 1035 | H87: 3 | I87: 1 | J87: NULL | K87: 1035 | L87: 1 | M87: 2015-07-16T00:00:00.000 | N87: 2017-07-12T00:00:00.000
A88: 1600024 | B88: 16 | C88: 40 | D88: Adaptateur Lightning pour casque | E88: L'outil essentiel pour pouvoir utiliser une prise auxilière avec un téléphone récent de Apple. | F88: =RC[-5]&".jpg" -> 1600024.jpg | G88: 9.99 | H88: 21 | I88: 1 | J88: NULL | K88: 9.99 | L88: 1 | M88: 2014-04-20T00:00:00.000 | N88: 2017-01-10T00:00:00.000
A89: 1600025 | B89: 16 | C89: 40 | D89: Chargeur sans fil Charge Stream Pad+ | E89: Un moyen rapide de recharger les appareils. Compatible avec Apple et Samsung! | F89: =RC[-5]&".jpg" -> 1600025.jpg | G89: 69.989999999999995 | H89: 9 | I89: 0 | J89: NULL | K89: 69.989999999999995 | L89: 1 | M89: 2014-09-12T00:00:00.000 | N89: 2015-09-13T00:00:00.000
A90: 1600026 | B90: 16 | C90: 50 | D90: Chausettes coussinés pour la course | E90: Ces chaussettes offre un support au pied qui réduit l'impact aux genous ainsi que d'offir un maximym de confort. | F90: =RC[-5]&".jpg" -> 1600026.jpg | G90: 27.99 | H90: 4 | I90: 1 | J90: NULL | K90: 27.99 | L90: 0.5 | M90: 2016-10-06T00:00:00.000 | N90: 2017-08-21T00:00:00.000
A91: 1600027 | B91: 16 | C91: 50 | D91: Aide à la traction | E91: Grip qui permet de courir sur une surface glacée sans glisser. À mettre sur les souliers de course. | F91: =RC[-5]&".jpg" -> 1600027.jpg | G91: 39.99 | H91: 8 | I91: 1 | J91: NULL | K91: 39.99 | L91: 1 | M91: 2014-03-07T00:00:00.000 | N91: 2016-08-03T00:00:00.000
A92: 1600028 | B92: 16 | C92: 50 | D92: Semelle | E92: Semelle avec coussin pour aider au choc et offir un confort au courreur. | F92: =RC[-5]&".jpg" -> 1600028.jpg | G92: 49.99 | H92: 4 | I92: 1 | J92: NULL | K92: 49.99 | L92: 0.1 | M92: 2017-11-26T00:00:00.000 | N92: 2018-04-13T00:00:00.000
A93: 1600029 | B93: 16 | C93: 50 | D93: Poussette de course | E93: Pousette aérodynamique qui permet au parent de courir en compagnie de son petit. | F93: =RC[-5]&".jpg" -> 1600029.jpg | G93: 529.99 | H93: 4 | I93: 1 | J93: NULL | K93: 529.99 | L93: 38.5 | M93: 2016-04-12T00:00:00.000 | N93: 2018-12-13T00:00:00.000
A94: 1600030 | B94: 16 | C94: 50 | D94: Souliers asics homme | E94: Souliers de course pour hommes type gt-2000 | F94: =RC[-5]&".jpg" -> 1600030.jpg | G94: 169.99 | H94: 13 | I94: 1 | J94: NULL | K94: 169.99 | L94: 3 | M94: 2014-03-21T00:00:00.000 | N94: 2018-11-23T00:00:00.000
A95: 1600031 | B95: 16 | C95: 50 | D95: Souliers Brooks homme | E95: Souliers de course pour la trail pour homme | F95: =RC[-5]&".jpg" -> 1600031.jpg | G95: 159.99 | H95: 4 | I95: 1 | J95: NULL | K95: 159.99 | L95: 2.6 | M95: 2014-02-01T00:00:00.000 | N95: 2017-12-04T00:00:00.000
A96: 1600032 | B96: 16 | C96: 50 | D96: Souliers Nike femmes | E96: Souliers de course pour femme type Nike Zoom | F96: =RC[-5]&".jpg" -> 1600032.jpg | G96: 144.99 | H96: 13 | I96: 1 | J96: NULL | K96: 144.99 | L96: 2.8 | M96: 2015-03-02T00:00:00.000 | N96: 2018-10-07T00:00:00.000
A97: 1600033 | B97: 16 | C97: 60 | D97: The Legend of Zelda : twilight princess | E97: Après un an et demi passé dans le paisible village de Toal, le jeune Link peut être fier de lui : sa gentillesse, son courage et sa dévotion lui ont permis d'être totalement intégré dans cette communauté. | F97: =RC[-5]&".jpg" -> 1600033.jpg | G97: 38.36 | H97: 3 | I97: 1 | J97: NULL | K97: 38.36 | L97: 3.7 | M97: 2015-07-01T00:00:00.000 | N97: 2016-11-18T00:00:00.000
A98: 1600034 | B98: 16 | C98: 60 | D98: La Petite Russie | E98: C’est une histoire de la colonisation de l’Abitibi. Un portrait d’hommes et de femmes qui ont tout quitté pour aller s’installer dans le Nord. Le récit d’un petit village qui s’appelle Guyenne. | F98: =RC[-5]&".jpg" -> 1600034.jpg | G98: 32 | H98: 5 | I98: 1 | J98: NULL | K98: 32 | L98: 3.4 | M98: 2016-01-26T00:00:00.000 | N98: 2016-05-03T00:00:00.000
A99: 1600035 | B99: 16 | C99: 60 | D99: Zoothérapie | E99: Catherine Lepage poursuit son étude imagée de la psyché humaine. Elle s’intéresse cette fois à la pression reliée à la performance, à notre monde qui va toujours plus vite et offre des pistes pour survivre dans cette jungle. | F99: =RC[-5]&".jpg" -> 1600035.jpg | G99: 18.82 | H99: 0 | I99: 1 | J99: NULL | K99: 18.82 | L99: 4.0999999999999996 | M99: 2015-05-06T00:00:00.000 | N99: 2015-09-16T00:00:00.000
A100: 1600036 | B100: 16 | C100: 60 | D100: Chasse à l'homme ! | E100: Les gags et les aventures coquines du héros Arthur entouré d'une multitude de filles sexy. | F100: =RC[-5]&".jpg" -> 1600036.jpg | G100: 21.63 | H100: 12 | I100: 1 | J100: NULL | K100: 21.63 | L100: 5.3 | M100: 2017-06-14T00:00:00.000 | N100: 2018-10-04T00:00:00.000
A101: 1600037 | B101: 16 | C101: 70 | D101: La montre Chase Timer | E101: À la fois élégante et décontractée, c'est la montre idéale pour vous accompagner au quotidien! Faite à la main par le grand l'horlogiste Ralph Benino | F101: =RC[-5]&".jpg" -> 1600037.jpg | G101: 845 | H101: 8 | I101: 1 | J101: NULL | K101: 845 | L101: 0.6 | M101: 2014-01-01T00:00:00.000 | N101: 2016-03-18T00:00:00.000
A102: 1600038 | B102: 16 | C102: 70 | D102: La montre luminescente bicolore | E102: L'inspiration rétro de la montre numérique remise au goût du jour avec ses teintes contrastantes | F102: =RC[-5]&".jpg" -> 1600038.jpg | G102: 99.99 | H102: 4 | I102: 1 | J102: NULL | K102: 99.99 | L102: 1.9 | M102: 2013-10-23T00:00:00.000 | N102: 2015-05-23T00:00:00.000
A103: 1600039 | B103: 16 | C103: 70 | D103: La montre Fairfield bleutée | E103: Une élégante pièce d'inspiration nautique qui plaira à l'homme moderne et aventurier! | F103: =RC[-5]&".jpg" -> 1600039.jpg | G103: 150 | H103: 1 | I103: 1 | J103: NULL | K103: 150 | L103: 1 | M103: 2014-05-19T00:00:00.000 | N103: 2018-11-11T00:00:00.000
A104: 1600040 | B104: 16 | C104: 80 | D104: Automobile téléguidé | E104: L'une des révélations des véhicules téléguidés Carrera Profi de cette année, c'est la licence de la marque américaine de véhicules tout-terrain, Jeep. | F104: =RC[-5]&".jpg" -> 1600040.jpg | G104: 139.99 | H104: 3 | I104: 1 | J104: NULL | K104: 139.99 | L104: 5.8 | M104: 2015-12-09T00:00:00.000 | N104: 2016-09-22T00:00:00.000
A105: 1800001 | B105: 18 | C105: 20 | D105: Imprimante EPSON 1000 | E105: Imprimante EPSON 1000 presque neuve | F105: Imprimante01.jpg | G105: 100 | H105: 1 | I105: 1 | J105: NULL | K105: =RC[-4] -> 100 | L105: 1.5 | M105: 2018-12-03T00:00:00.000 | N105: NULL
A106: 1800002 | B106: 18 | C106: 20 | D106: Imprimante de qualité EPSON LQ300 | E106: Imprimante EPSON LQ300 presque pas utilisée | F106: Imprimante02.jpg | G106: 50 | H106: 2 | I106: 1 | J106: NULL | K106: =RC[-4] -> 50 | L106: 2 | M106: 2018-12-05T00:00:00.000 | N106: NULL
A107: 1800003 | B107: 18 | C107: 20 | D107: Imprimante INTERMEC EasyCoder PX4i | E107: Imprimante INTERMEC EasyCoder PX4i avec cartouches d'encre | F107: Imprimante03.jpg | G107: 150 | H107: 3 | I107: 1 | J107: NULL | K107: =RC[-4] -> 150 | L107: 2 | M107: 2018-12-08T00:00:00.000 | N107: NULL
A108: 1800004 | B108: 18 | C108: 20 | D108: Imprimante impressionnante HP lj6p | E108: Imprimante HP lj6p | F108: Imprimante04.jpg | G108: 200 | H108: 4 | I108: 1 | J108: NULL | K108: =RC[-4] -> 200 | L108: 8.5 | M108: 2018-12-10T00:00:00.000 | N108: NULL
A109: 1800005 | B109: 18 | C109: 20 | D109: Imprimante DELL fantastique 1710N | E109: Imprimante DELL 1710N + Manuel d'utilisation | F109: Imprimante05.jpg | G109: 250 | H109: 5 | I109: 1 | J109: NULL | K109: =RC[-4] -> 250 | L109: 12.5 | M109: 2018-12-10T00:00:00.000 | N109: NULL
A110: 1800006 | B110: 18 | C110: 20 | D110: Imprimante CANON and BALL IP 1700 | E110: Imprimante CANON IP 1700 | F110: Imprimante06.jpg | G110: 100 | H110: 1 | I110: 1 | J110: NULL | K110: =RC[-4] -> 100 | L110: 2 | M110: 2018-12-10T00:00:00.000 | N110: NULL
A111: 1800007 | B111: 18 | C111: 20 | D111: Imprimante APPLE LaserWriter Pro 630 | E111: Imprimante APPLE LaserWriter Pro 630 + Disquette d'installation | F111: Imprimante07.jpg | G111: 100 | H111: 2 | I111: 1 | J111: NULL | K111: =RC[-4] -> 100 | L111: 10 | M111: 2018-12-14T00:00:00.000 | N111: NULL
A112: 1800008 | B112: 18 | C112: 20 | D112: Imprimante HP PaintWriter Optimum | E112: Imprimante HP PaintWriter Optimum + Cartouches | F112: Imprimante08.jpg | G112: 100 | H112: 3 | I112: 1 | J112: NULL | K112: =RC[-4] -> 100 | L112: 2 | M112: 2018-12-16T00:00:00.000 | N112: NULL
A113: 1800009 | B113: 18 | C113: 20 | D113: Imprimante DELL Laser 964 | E113: Imprimante DELL Laser 964 + Toner | F113: Imprimante09.jpg | G113: 250 | H113: 4 | I113: 1 | J113: 2018-03-31T00:00:00.000 | K113: =RC[-4] -> 250 | L113: 8.5 | M113: 2018-12-16T00:00:00.000 | N113: NULL
A114: 1800010 | B114: 18 | C114: 20 | D114: Imprimante CTS300 Pharmaceutique | E114: Imprimante CTS300 Pharmaceutique | F114: Imprimante10.jpg | G114: 250 | H114: 5 | I114: 1 | J114: 2018-03-31T00:00:00.000 | K114: =RC[-4] -> 250 | L114: 1 | M114: 2018-12-18T00:00:00.000 | N114: NULL
A115: 1800011 | B115: 18 | C115: 20 | D115: Imprimante EPSON Stylus C62 | E115: Imprimante EPSON Stylus C62 | F115: Imprimante11.jpg | G115: 100 | H115: 1 | I115: 1 | J115: NULL | K115: =RC[-4] -> 100 | L115: 2.5 | M115: 2018-12-19T00:00:00.000 | N115: NULL
A116: 1800012 | B116: 18 | C116: 20 | D116: Imprimante HP Laser couleur B00006L | E116: Imprimante HP Laser couleur B00006L + Toner rouge et noir | F116: Imprimante12.jpg | G116: 150 | H116: 2 | I116: 1 | J116: NULL | K116: =RC[-4] -> 150 | L116: 12.5 | M116: 2018-12-20T00:00:00.000 | N116: NULL
A117: 1800013 | B117: 18 | C117: 20 | D117: Imprimante APPLE ImageWriter Optimum | E117: Imprimante APPLE ImageWriter Optimum | F117: Imprimante13.jpg | G117: 50 | H117: 3 | I117: 0 | J117: NULL | K117: =RC[-4] -> 50 | L117: 2 | M117: 2018-12-21T00:00:00.000 | N117: NULL
A118: 1800014 | B118: 18 | C118: 20 | D118: Imprimante BROTHER and SISTER 12415 | E118: Imprimante BROTHER 12415 | F118: Imprimante14.jpg | G118: 100 | H118: 4 | I118: 1 | J118: NULL | K118: =RC[-4] -> 100 | L118: 1.5 | M118: 2018-12-24T00:00:00.000 | N118: NULL
A119: 1800015 | B119: 18 | C119: 20 | D119: Imprimante INTHEDARK Braille Plus | E119: Imprimante INTHEDARK Braille + 2 boîtes de papier | F119: Imprimante15.jpg | G119: 250 | H119: 5 | I119: 1 | J119: NULL | K119: =RC[-4] -> 250 | L119: 5.5 | M119: 2018-12-25T00:00:00.000 | N119: NULL
A120: 1800016 | B120: 18 | C120: 20 | D120: Imprimante EPSON STYLUS C66 | E120: Imprimante EPSON STYLUS C66 | F120: Imprimante16.jpg | G120: 100 | H120: 1 | I120: 1 | J120: NULL | K120: =RC[-4] -> 100 | L120: 2.5 | M120: 2019-01-08T00:00:00.000 | N120: NULL
A121: 1800017 | B121: 18 | C121: 20 | D121: Imprimante HP LaserJet 1022 | E121: Imprimante HP LaserJet 1022 | F121: Imprimante17.jpg | G121: 150 | H121: 2 | I121: 1 | J121: NULL | K121: =RC[-4] -> 150 | L121: 10.5 | M121: 2019-01-09T00:00:00.000 | N121: NULL
A122: 1800018 | B122: 18 | C122: 20 | D122: Imprimante HP Couleur 700 | E122: Imprimante HP Couleur 700 + Toner | F122: Imprimante18.jpg | G122: 100 | H122: 3 | I122: 1 | J122: NULL | K122: =RC[-4] -> 100 | L122: 2.5 | M122: 2019-01-09T00:00:00.000 | N122: NULL
A123: 1800019 | B123: 18 | C123: 20 | D123: Imprimante BROTHER and SISTER Laser HL 1440 | E123: Imprimante BROTHER Laser HL 1440 | F123: Imprimante19.jpg | G123: 250 | H123: 4 | I123: 1 | J123: NULL | K123: =RC[-4] -> 250 | L123: 10 | M123: 2019-01-12T00:00:00.000 | N123: NULL
A124: 1800020 | B124: 18 | C124: 20 | D124: Imprimante CANON 4200G | E124: Imprimante CANON 4200G | F124: Imprimante20.jpg | G124: 100 | H124: 5 | I124: 1 | J124: NULL | K124: =RC[-4] -> 100 | L124: 3.5 | M124: 2019-01-25T00:00:00.000 | N124: NULL
A125: 1800021 | B125: 18 | C125: 20 | D125: Imprimante EPSON AcuLaser Massage C9100 | E125: Imprimante EPSON AcuLaser C9100 | F125: Imprimante21.jpg | G125: 350 | H125: 1 | I125: 1 | J125: 2018-03-31T00:00:00.000 | K125: =RC[-4] -> 350 | L125: 15 | M125: 2019-02-04T00:00:00.000 | N125: NULL
A126: 1800022 | B126: 18 | C126: 20 | D126: Imprimante CITIZEN 124D | E126: Imprimante CITIZEN 124D | F126: Imprimante22.jpg | G126: 50 | H126: 2 | I126: 1 | J126: NULL | K126: =RC[-4] -> 50 | L126: 2 | M126: 2019-02-04T00:00:00.000 | N126: NULL
A127: 1800023 | B127: 18 | C127: 20 | D127: Imprimante HP Deskjet 450 | E127: Imprimante HP Deskjet 450 | F127: Imprimante23.jpg | G127: 50 | H127: 3 | I127: 1 | J127: NULL | K127: =RC[-4] -> 50 | L127: 3.5 | M127: 2019-02-07T00:00:00.000 | N127: NULL
A128: 1800024 | B128: 18 | C128: 20 | D128: Imprimante CANON PIXMA iP4200 | E128: Imprimante CANON PIXMA iP4200 + Cartouches d'encre | F128: Imprimante24.jpg | G128: 150 | H128: 4 | I128: 1 | J128: NULL | K128: =RC[-4] -> 150 | L128: 2.5 | M128: 2019-02-08T00:00:00.000 | N128: NULL
A129: 1800025 | B129: 18 | C129: 20 | D129: Imprimante HP Laser B119033 | E129: Imprimante HP Laser B119033 | F129: Imprimante25.jpg | G129: 100 | H129: 5 | I129: 1 | J129: NULL | K129: =RC[-4] -> 100 | L129: 1 | M129: 2019-02-17T00:00:00.000 | N129: NULL
A130: 1900001 | B130: 19 | C130: 20 | D130: Produit1 | E130: Description de Produit1 | F130: produit1.jpg | G130: 100 | H130: 5 | I130: 1 | J130: NULL | K130: =RC[-4] -> 100 | L130: 2 | M130: 2019-01-24T00:00:00.000 | N130: NULL
A131: 2000001 | B131: 20 | C131: 20 | D131: Produit2 | E131: Description de Produit2 | F131: produit2.jpg | G131: 100 | H131: 5 | I131: 1 | J131: NULL | K131: =RC[-4] -> 100 | L131: 3 | M131: 2019-01-24T00:00:00.000 | N131: NULL

Sheet: PPArticlesEnPanier
A1: 100001001 | B1: 10001 | C1: 11 | D1: 1100015 | E1: 2017-04-02T00:00:00.000 | F1: 1
A2: 100001002 | B2: 10001 | C2: 11 | D2: 1100001 | E2: 2017-04-02T00:00:00.000 | F2: 2
A3: 100001003 | B3: 10001 | C3: 11 | D3: 1100006 | E3: 2017-04-02T00:00:00.000 | F3: 2
A4: 100001004 | B4: 10001 | C4: 11 | D4: 1100012 | E4: 2017-04-02T00:00:00.000 | F4: 3
A5: 100002001 | B5: 10001 | C5: 12 | D5: 1200004 | E5: 2016-02-02T00:00:00.000 | F5: 1
A6: 100002002 | B6: 10001 | C6: 12 | D6: 1200006 | E6: 2016-02-02T00:00:00.000 | F6: 3
A7: 100003001 | B7: 10001 | C7: 16 | D7: 1600009 | E7: 2018-08-04T00:00:00.000 | F7: 1
A8: 100003002 | B8: 10001 | C8: 16 | D8: 1600011 | E8: 2018-08-04T00:00:00.000 | F8: 1
A9: 100003003 | B9: 10001 | C9: 16 | D9: 1600003 | E9: 2018-08-04T00:00:00.000 | F9: 2
A10: 100004001 | B10: 10004 | C10: 12 | D10: 1200007 | E10: 2018-03-04T00:00:00.000 | F10: 1
A11: 100004002 | B11: 10004 | C11: 12 | D11: 1200009 | E11: 2018-03-04T00:00:00.000 | F11: 4
A12: 100004003 | B12: 10004 | C12: 12 | D12: 1200002 | E12: 2018-03-04T00:00:00.000 | F12: 1
A13: 100004004 | B13: 10004 | C13: 12 | D13: 1200013 | E13: 2018-03-04T00:00:00.000 | F13: 4
A14: 100004005 | B14: 10004 | C14: 12 | D14: 1200011 | E14: 2018-03-04T00:00:00.000 | F14: 1
A15: 100005001 | B15: 10004 | C15: 14 | D15: 1400001 | E15: 2018-10-09T00:00:00.000 | F15: 1
A16: 100005002 | B16: 10004 | C16: 14 | D16: 1400008 | E16: 2018-10-09T00:00:00.000 | F16: 1
A17: 100006001 | B17: 10004 | C17: 16 | D17: 1600001 | E17: 2018-04-23T00:00:00.000 | F17: 2
A18: 100007001 | B18: 10010 | C18: 11 | D18: 1100014 | E18: 2018-01-17T00:00:00.000 | F18: 1
A19: 100007002 | B19: 10010 | C19: 11 | D19: 1100004 | E19: 2018-01-17T00:00:00.000 | F19: 1
A20: 100007003 | B20: 10010 | C20: 11 | D20: 1100008 | E20: 2018-01-17T00:00:00.000 | F20: 1
A21: 100008001 | B21: 10010 | C21: 12 | D21: 1200002 | E21: 2018-10-28T00:00:00.000 | F21: 1
A22: 100008002 | B22: 10010 | C22: 12 | D22: 1200013 | E22: 2018-10-28T00:00:00.000 | F22: 2
A23: 100009001 | B23: 10016 | C23: 12 | D23: 1200012 | E23: 2018-01-01T00:00:00.000 | F23: 1
A24: 100009002 | B24: 10016 | C24: 12 | D24: 1200010 | E24: 2018-01-01T00:00:00.000 | F24: 1
A25: 100010001 | B25: 10019 | C25: 12 | D25: 1200009 | E25: 2018-06-20T00:00:00.000 | F25: 2
A26: 100010002 | B26: 10019 | C26: 12 | D26: 1200002 | E26: 2018-06-20T00:00:00.000 | F26: 1
A27: 100010003 | B27: 10019 | C27: 12 | D27: 1200004 | E27: 2018-06-20T00:00:00.000 | F27: 1
A28: 100011001 | B28: 10019 | C28: 14 | D28: 1400004 | E28: 2018-05-30T00:00:00.000 | F28: 1
A29: 100011002 | B29: 10019 | C29: 14 | D29: 1400008 | E29: 2018-05-30T00:00:00.000 | F29: 2
A30: 100012001 | B30: 10023 | C30: 19 | D30: 1900001 | E30: 2019-02-22T00:00:00.000 | F30: 1
A31: 100013001 | B31: 10024 | C31: 20 | D31: 2000001 | E31: 2019-02-23T00:00:00.000 | F31: 1

Sheet: PPTypesLivraison
A1: 1 | B1: Poste régulière
A2: 2 | B2: Poste prioritaire
A3: 3 | B3: Transport privé

Sheet: PPTypesPoids
A1: 10 | B1: 0 | C1: 4.9000000000000004
A2: 20 | B2: 5 | C2: 19.899999999999999
A3: 30 | B3: 20 | C3: 99.9
A4: 40 | B4: 100 | C4: 999999.9

Sheet: PPPoidsLivraisons
A1: 1 | B1: 10 | C1: 4.5
A2: 1 | B2: 20 | C2: 12.5
A3: 1 | B3: 30 | C3: 25
A4: 1 | B4: 40 | C4: 35
A5: 2 | B5: 10 | C5: 6.75
A6: 2 | B6: 20 | C6: 15.75
A7: 2 | B7: 30 | C7: 29
A8: 2 | B8: 40 | C8: 45
A9: 3 | B9: 10 | C9: 15
A10: 3 | B10: 20 | C10: 20
A11: 3 | B11: 30 | C11: 35
A12: 3 | B12: 40 | C12: 50

Sheet: PPCommandes
A1: 1 | B1: 10001 | C1: 11 | D1: 2018-06-18T00:00:00.000 | E1: 0 | F1: 1 | G1: =RC[-2]+264.96 -> 264.95999999999998 | H1: =RC[-1]*0.05 -> 13.247999999999999 | I1: =RC[-2]*0.09975 -> 26.429759999999998 | J1: 4.4000000000000004 | K1: 0 | L1: 2511
A2: 2 | B2: 10001 | C2: 16 | D2: 2018-11-13T00:00:00.000 | E2: 20 | F2: 3 | G2: =RC[-2]+208.99 -> 228.99 | H2: =RC[-1]*0.05 -> 11.4495 | I2: =RC[-2]*0.09975 -> 22.841752500000002 | J2: 9.6 | K2: 0 | L2: 2355
A3: 3 | B3: 10002 | C3: 12 | D3: 2018-04-29T00:00:00.000 | E3: 0 | F3: 1 | G3: =RC[-2]+3352.97 -> 3352.97 | H3: =RC[-1]*0.05 -> 167.64850000000001 | I3: =RC[-2]*0.09975 -> 334.45875749999999 | J3: 16.8 | K3: 0 | L3: 2319
A4: 4 | B4: 10004 | C4: 14 | D4: 2018-12-09T00:00:00.000 | E4: 20 | F4: 3 | G4: =RC[-2]+1139.95 -> 1159.95 | H4: =RC[-1]*0.05 -> 57.997500000000002 | I4: =RC[-2]*0.09975 -> 115.70501250000001 | J4: 8.5 | K4: 0 | L4: 2708
A5: 5 | B5: 10014 | C5: 14 | D5: 2018-05-28T00:00:00.000 | E5: 20 | F5: 3 | G5: =RC[-2]+654.16 -> 674.16 | H5: =RC[-1]*0.05 -> 33.707999999999998 | I5: =RC[-2]*0.09975 -> 67.247460000000004 | J5: 19.7 | K5: 0 | L5: 2775
A6: 6 | B6: 10018 | C6: 12 | D6: 2018-02-01T00:00:00.000 | E6: 0 | F6: 1 | G6: =RC[-2]+300.96 -> 300.95999999999998 | H6: =RC[-1]*0.05 -> 15.048 | I6: =RC[-2]*0.09975 -> 30.020759999999999 | J6: 7.5 | K6: 0 | L6: 3259
A7: 7 | B7: 10019 | C7: 12 | D7: 2018-08-24T00:00:00.000 | E7: 15.75 | F7: 2 | G7: =RC[-2]+208 -> 223.75 | H7: =RC[-1]*0.05 -> 11.1875 | I7: =RC[-2]*0.09975 -> 22.319062500000001 | J7: 5 | K7: 0 | L7: 2218
A8: 8 | B8: 10020 | C8: 16 | D8: 2018-01-19T00:00:00.000 | E8: 0 | F8: 1 | G8: =RC[-2]+172.98 -> 172.98 | H8: =RC[-1]*0.05 -> 8.6489999999999991 | I8: =RC[-2]*0.09975 -> 17.254754999999999 | J8: 4.5 | K8: 0 | L8: 2085
A9: 9 | B9: 10001 | C9: 11 | D9: 2018-06-06T00:00:00.000 | E9: 0 | F9: 1 | G9: =RC[-2]+516 -> 516 | H9: =RC[-1]*0.05 -> 25.8 | I9: =RC[-2]*0.09975 -> 51.471000000000004 | J9: 9.1 | K9: 1 | L9: 3760
A10: 10 | B10: 10001 | C10: 11 | D10: 2018-04-08T00:00:00.000 | E10: 15.75 | F10: 2 | G10: =RC[-2]+789.94 -> 805.69 | H10: =RC[-1]*0.05 -> 40.284500000000008 | I10: =RC[-2]*0.09975 -> 80.36757750000001 | J10: 8.5 | K10: 1 | L10: 1634
A11: 11 | B11: 10008 | C11: 12 | D11: 2018-03-01T00:00:00.000 | E11: 35 | F11: 3 | G11: =RC[-2]+4031.07 -> 4066.07 | H11: =RC[-1]*0.05 -> 203.30350000000001 | I11: =RC[-2]*0.09975 -> 405.59048250000006 | J11: 45.97 | K11: 1 | L11: 4234
A12: 12 | B12: 10014 | C12: 12 | D12: 2018-05-21T00:00:00.000 | E12: 15.75 | F12: 2 | G12: =RC[-2]+1604 -> 1619.75 | H12: =RC[-1]*0.05 -> 80.987500000000011 | I12: =RC[-2]*0.09975 -> 161.57006250000001 | J12: 6.8 | K12: 1 | L12: 3244
A13: 13 | B13: 10014 | C13: 16 | D13: 2018-02-02T00:00:00.000 | E13: 0 | F13: 1 | G13: =RC[-2]+282.99 -> 282.99 | H13: =RC[-1]*0.05 -> 14.149500000000002 | I13: =RC[-2]*0.09975 -> 28.228252500000004 | J13: 4.9000000000000004 | K13: 1 | L13: 1343
A14: 14 | B14: 10014 | C14: 16 | D14: 2018-01-23T00:00:00.000 | E14: 6.75 | F14: 2 | G14: =RC[-2]+134.98 -> 141.72999999999999 | H14: =RC[-1]*0.05 -> 7.0865 | I14: =RC[-2]*0.09975 -> 14.137567499999999 | J14: 3.4 | K14: 1 | L14: 3234
A15: 15 | B15: 10014 | C15: 16 | D15: 2018-11-29T00:00:00.000 | E15: 0 | F15: 1 | G15: =RC[-2]+751.96 -> 751.96 | H15: =RC[-1]*0.05 -> 37.598000000000006 | I15: =RC[-2]*0.09975 -> 75.008010000000013 | J15: 6.2 | K15: 1 | L15: 2653
A16: 16 | B16: 10020 | C16: 12 | D16: 2018-08-24T00:00:00.000 | E16: 0 | F16: 1 | G16: =RC[-2]+2001.1 -> 2001.1 | H16: =RC[-1]*0.05 -> 100.05500000000001 | I16: =RC[-2]*0.09975 -> 199.609725 | J16: 37.67 | K16: 1 | L16: 2766
A17: 17 | B17: 10020 | C17: 12 | D17: 2018-04-04T00:00:00.000 | E17: 0 | F17: 1 | G17: =RC[-2]+461.97 -> 461.97 | H17: =RC[-1]*0.05 -> 23.098500000000001 | I17: =RC[-2]*0.09975 -> 46.081507500000008 | J17: 20.399999999999999 | K17: 1 | L17: 3023
A18: 18 | B18: 10025 | C18: 20 | D18: 2019-01-05T00:00:00.000 | E18: 0 | F18: 1 | G18: 100 | H18: =RC[-1]*0.05 -> 5 | I18: =RC[-2]*0.09975 -> 9.9750000000000014 | J18: 3 | K18: 0 | L18: 4444

Sheet: PPDetailsCommandes
A1: 1 | B1: 1 | C1: 1100010 | D1: =VLOOKUP(RC[-1],PPProduits!R1C1:R104C14,11,FALSE) -> 79.989999999999995 | E1: 3
A2: 2 | B2: 1 | C2: 1100018 | D2: =VLOOKUP(RC[-1],PPProduits!R1C1:R104C14,11,FALSE) -> 24.99 | E2: 1
A3: 3 | B3: 2 | C3: 1600032 | D3: =VLOOKUP(RC[-1],PPProduits!R1C1:R104C14,11,FALSE) -> 144.99 | E3: 1
A4: 4 | B4: 2 | C4: 1600034 | D4: =VLOOKUP(RC[-1],PPProduits!R1C1:R104C14,11,FALSE) -> 32 | E4: 2
A5: 5 | B5: 3 | C5: 1200002 | D5: =VLOOKUP(RC[-1],PPProduits!R1C1:R104C14,11,FALSE) -> 1740 | E5: 1
A6: 6 | B6: 3 | C6: 1200001 | D6: =VLOOKUP(RC[-1],PPProduits!R1C1:R104C14,11,FALSE) -> 1250.99 | E6: 1
A7: 7 | B7: 3 | C7: 1200009 | D7: =VLOOKUP(RC[-1],PPProduits!R1C1:R104C14,11,FALSE) -> 180.99 | E7: 2
A8: 8 | B8: 4 | C8: 1400005 | D8: =VLOOKUP(RC[-1],PPProduits!R1C1:R104C14,11,FALSE) -> 799.99 | E8: 1
A9: 9 | B9: 4 | C9: 1400007 | D9: =VLOOKUP(RC[-1],PPProduits!R1C1:R104C14,11,FALSE) -> 129.99 | E9: 1
A10: 10 | B10: 4 | C10: 1400008 | D10: =VLOOKUP(RC[-1],PPProduits!R1C1:R104C14,11,FALSE) -> 79.989999999999995 | E10: 2
A11: 11 | B11: 4 | C11: 1400009 | D11: =VLOOKUP(RC[-1],PPProduits!R1C1:R104C14,11,FALSE) -> 49.99 | E11: 1
A12: 12 | B12: 5 | C12: 1400013 | D12: =VLOOKUP(RC[-1],PPProduits!R1C1:R104C14,11,FALSE) -> 54.17 | E12: 1
A13: 13 | B13: 5 | C13: 1400015 | D13: =VLOOKUP(RC[-1],PPProduits!R1C1:R104C14,11,FALSE) -> 599.99 | E13: 1
A14: 14 | B14: 6 | C14: 1200011 | D14: =VLOOKUP(RC[-1],PPProduits!R1C1:R104C14,11,FALSE) -> 39.99 | E14: 3
A15: 15 | B15: 6 | C15: 1200009 | D15: =VLOOKUP(RC[-1],PPProduits!R1C1:R104C14,11,FALSE) -> 180.99 | E15: 1
A16: 16 | B16: 7 | C16: 1200013 | D16: =VLOOKUP(RC[-1],PPProduits!R1C1:R104C14,11,FALSE) -> 104 | E16: 2
A17: 17 | B17: 8 | C17: 1600003 | D17: =VLOOKUP(RC[-1],PPProduits!R1C1:R104C14,11,FALSE) -> 39.99 | E17: 1
A18: 18 | B18: 8 | C18: 1600007 | D18: =VLOOKUP(RC[-1],PPProduits!R1C1:R104C14,11,FALSE) -> 27.99 | E18: 1
A19: 19 | B19: 8 | C19: 1600014 | D19: =VLOOKUP(RC[-1],PPProduits!R1C1:R104C14,11,FALSE) -> 105 | E19: 1
A20: 20 | B20: 9 | C20: 1100002 | D20: =VLOOKUP(RC[-1],PPProduits!R1C1:R104C14,11,FALSE) -> 230 | E20: 1
A21: 21 | B21: 9 | C21: 1100006 | D21: =VLOOKUP(RC[-1],PPProduits!R1C1:R104C14,11,FALSE) -> 286 | E21: 1
A22: 22 | B22: 10 | C22: 1100008 | D22: =VLOOKUP(RC[-1],PPProduits!R1C1:R104C14,11,FALSE) -> 429.99 | E22: 1
A23: 23 | B23: 10 | C23: 1100015 | D23: =VLOOKUP(RC[-1],PPProduits!R1C1:R104C14,11,FALSE) -> 29.95 | E23: 1
A24: 24 | B24: 10 | C24: 1100002 | D24: =VLOOKUP(RC[-1],PPProduits!R1C1:R104C14,11,FALSE) -> 230 | E24: 1
A25: 25 | B25: 11 | C25: 1200005 | D25: =VLOOKUP(RC[-1],PPProduits!R1C1:R104C14,11,FALSE) -> 2001.1 | E25: 1
A26: 26 | B26: 11 | C26: 1200011 | D26: =VLOOKUP(RC[-1],PPProduits!R1C1:R104C14,11,FALSE) -> 39.99 | E26: 2
A27: 27 | B27: 11 | C27: 1200012 | D27: =VLOOKUP(RC[-1],PPProduits!R1C1:R104C14,11,FALSE) -> 209.99 | E27: 1
A28: 28 | B28: 11 | C28: 1200002 | D28: =VLOOKUP(RC[-1],PPProduits!R1C1:R104C14,11,FALSE) -> 1740 | E28: 1
A29: 29 | B29: 12 | C29: 1200003 | D29: =VLOOKUP(RC[-1],PPProduits!R1C1:R104C14,11,FALSE) -> 1500 | E29: 1
A30: 30 | B30: 12 | C30: 1200013 | D30: =VLOOKUP(RC[-1],PPProduits!R1C1:R104C14,11,FALSE) -> 104 | E30: 1
A31: 31 | B31: 13 | C31: 1600017 | D31: =VLOOKUP(RC[-1],PPProduits!R1C1:R104C14,11,FALSE) -> 118 | E31: 1
A32: 32 | B32: 13 | C32: 1600025 | D32: =VLOOKUP(RC[-1],PPProduits!R1C1:R104C14,11,FALSE) -> 69.989999999999995 | E32: 1
A33: 33 | B33: 13 | C33: 1600006 | D33: =VLOOKUP(RC[-1],PPProduits!R1C1:R104C14,11,FALSE) -> 64.989999999999995 | E33: 1
A34: 34 | B34: 14 | C34: 1600008 | D34: =VLOOKUP(RC[-1],PPProduits!R1C1:R104C14,11,FALSE) -> 79.989999999999995 | E34: 1
A35: 35 | B35: 14 | C35: 1600001 | D35: =VLOOKUP(RC[-1],PPProduits!R1C1:R104C14,11,FALSE) -> 24.99 | E35: 1
A36: 36 | B36: 15 | C36: 1600004 | D36: =VLOOKUP(RC[-1],PPProduits!R1C1:R104C14,11,FALSE) -> 73.989999999999995 | E36: 2
A37: 37 | B37: 15 | C37: 1600007 | D37: =VLOOKUP(RC[-1],PPProduits!R1C1:R104C14,11,FALSE) -> 27.99 | E37: 1
A38: 38 | B38: 15 | C38: 1600015 | D38: =VLOOKUP(RC[-1],PPProduits!R1C1:R104C14,11,FALSE) -> 76 | E38: 1
A39: 39 | B39: 15 | C39: 1600022 | D39: =VLOOKUP(RC[-1],PPProduits!R1C1:R104C14,11,FALSE) -> 499.99 | E39: 1
A40: 40 | B40: 16 | C40: 1200005 | D40: =VLOOKUP(RC[-1],PPProduits!R1C1:R104C14,11,FALSE) -> 2001.1 | E40: 1
A41: 41 | B41: 17 | C41: 1200012 | D41: =VLOOKUP(RC[-1],PPProduits!R1C1:R104C14,11,FALSE) -> 209.99 | E41: 1
A42: 42 | B42: 17 | C42: 1200010 | D42: =VLOOKUP(RC[-1],PPProduits!R1C1:R104C14,11,FALSE) -> 125.99 | E42: 2
A43: 43 | B43: 18 | C43: 2000001 | D43: 100 | E43: 1

Sheet: PPHistoriquePaiements
A1: 1 | B1: 264.95999999999998 | C1: 11 | D1: 10001 | E1: 1 | F1: 2018-06-18T00:00:00.000 | G1: 1002 | H1: =0.05*(RC[-6]+RC[4]+RC[3]+RC[2])+1.25 -> 16.740581749999997 | I1: =(10.68/100)*(RC[3]+RC[2]+RC[-7]+4.5) -> 33.087882617999995 | J1: 4.5 | K1: 13.472999999999999 | L1: 26.878634999999999
A2: 2 | B2: 208.99 | C2: 16 | D2: 10001 | E2: 2 | F2: 2018-11-13T00:00:00.000 | G2: 1634 | H2: =0.05*(RC[-6]+RC[4]+RC[3]+RC[2])+1.25 -> 14.414062625000003 | I2: =(8.38/100)*(RC[3]+RC[2]+RC[-7]) -> 20.386968959500003 | J2: 20 | K2: 11.4495 | L2: 22.841752500000002
A3: 3 | B3: 3352.97 | C3: 12 | D3: 10002 | E3: 3 | F3: 2018-04-29T00:00:00.000 | G3: 4234 | H3: =0.05*(RC[-6]+RC[4]+RC[3]+RC[2])+1.25 -> 194.00386287500001 | I3: =(9.15/100)*(RC[3]+RC[2]+RC[-7]) -> 352.73956906124994 | J3: 0 | K3: 167.64850000000001 | L3: 334.45875749999999
A4: 4 | B4: 1139.95 | C4: 14 | D4: 10004 | E4: 4 | F4: 2018-12-09T00:00:00.000 | G4: 3244 | H4: =0.05*(RC[-6]+RC[4]+RC[3]+RC[2])+1.25 -> 67.932625625 | I4: =(28.05/100)*(RC[3]+RC[2]+RC[-7]) -> 368.47952975625003 | J4: 20 | K4: 57.997500000000002 | L4: 115.70501250000001
A5: 5 | B5: 654.16 | C5: 14 | D5: 10014 | E5: 5 | F5: 2018-05-28T00:00:00.000 | G5: 1343 | H5: =0.05*(RC[-6]+RC[4]+RC[3]+RC[2])+1.25 -> 40.005773000000005 | I5: =(28.05/100)*(RC[3]+RC[2]+RC[-7]) -> 211.80988653000003 | J5: 20 | K5: 33.707999999999998 | L5: 67.247460000000004
A6: 6 | B6: 300.95999999999998 | C6: 12 | D6: 10018 | E6: 6 | F6: 2018-02-04T00:00:00.000 | G6: 3234 | H6: =0.05*(RC[-6]+RC[4]+RC[3]+RC[2])+1.25 -> 18.551438000000001 | I6: =(9.15/100)*(RC[3]+RC[2]+RC[-7]) -> 31.661631539999998 | J6: 0 | K6: 15.048 | L6: 30.020759999999999
A7: 7 | B7: 208 | C7: 12 | D7: 10019 | E7: 7 | F7: 2018-08-24T00:00:00.000 | G7: 2653 | H7: =0.05*(RC[-6]+RC[4]+RC[3]+RC[2])+1.25 -> 14.112828125 | I7: =(9.15/100)*(RC[3]+RC[2]+RC[-7]) -> 22.09785046875 | J7: 15.75 | K7: 11.1875 | L7: 22.319062500000001
A8: 8 | B8: 172.98 | C8: 16 | D8: 10020 | E8: 8 | F8: 2018-01-19T00:00:00.000 | G8: 2766 | H8: =0.05*(RC[-6]+RC[4]+RC[3]+RC[2])+1.25 -> 11.194187749999999 | I8: =(8.38/100)*(RC[3]+RC[2]+RC[-7]) -> 16.666458669000001 | J8: 0 | K8: 8.6489999999999991 | L8: 17.254754999999999
A9: 9 | B9: =R[14]C[3]+516 -> 516 | C9: 11 | D9: 10001 | E9: 9 | F9: 2018-06-06T00:00:00.000 | G9: 3760 | H9: =0.05*(RC[-6]+RC[4]+RC[3]+RC[2])+1.25 -> 30.913550000000001 | I9: =(8.38/100)*(RC[3]+RC[2]+RC[-7]) -> 49.716109800000005 | J9: 0 | K9: 25.8 | L9: 51.471000000000004
A10: 10 | B10: =R[14]C[3]+789.94 -> 789.94 | C10: 11 | D10: 10001 | E10: 10 | F10: 2018-04-08T00:00:00.000 | G10: 1634 | H10: =0.05*(RC[-6]+RC[4]+RC[3]+RC[2])+1.25 -> 47.567103875000008 | I10: =(8.38/100)*(RC[3]+RC[2]+RC[-7]) -> 76.30761609450002 | J10: 15.75 | K10: 40.284500000000008 | L10: 80.36757750000001
A11: 11 | B11: =R[14]C[3]+4031.07 -> 4031.07 | C11: 12 | D11: 10008 | E11: 11 | F11: 2018-03-01T00:00:00.000 | G11: 4234 | H11: =0.05*(RC[-6]+RC[4]+RC[3]+RC[2])+1.25 -> 234.99819912500004 | I11: =(8.38/100)*(RC[3]+RC[2]+RC[-7]) -> 388.82898173350009 | J11: 35 | K11: 203.30350000000001 | L11: 405.59048250000006
A12: 12 | B12: =R[14]C[3]+1604 -> 1604 | C12: 12 | D12: 10014 | E12: 12 | F12: 2018-05-21T00:00:00.000 | G12: 3244 | H12: =0.05*(RC[-6]+RC[4]+RC[3]+RC[2])+1.25 -> 94.365378125000007 | I12: =(8.38/100)*(RC[3]+RC[2]+RC[-7]) -> 154.74152373750005 | J12: 15.75 | K12: 80.987500000000011 | L12: 161.57006250000001
A13: 13 | B13: =R[14]C[3]+282.99 -> 282.99 | C13: 16 | D13: 10014 | E13: 13 | F13: 2018-02-02T00:00:00.000 | G13: 1343 | H13: =0.05*(RC[-6]+RC[4]+RC[3]+RC[2])+1.25 -> 17.518387624999999 | I13: =(8.38/100)*(RC[3]+RC[2]+RC[-7]) -> 27.265817659500005 | J13: 0 | K13: 14.149500000000002 | L13: 28.228252500000004
A14: 14 | B14: =R[14]C[3]+134.98 -> 134.97999999999999 | C14: 16 | D14: 10014 | E14: 14 | F14: 2018-01-23T00:00:00.000 | G14: 3234 | H14: =0.05*(RC[-6]+RC[4]+RC[3]+RC[2])+1.25 -> 9.397703374999999 | I14: =(8.38/100)*(RC[3]+RC[2]+RC[-7]) -> 13.0899008565 | J14: 6.75 | K14: 7.0865 | L14: 14.137567499999999
A15: 15 | B15: =R[14]C[3]+751.96 -> 751.96 | C15: 16 | D15: 10014 | E15: 15 | F15: 2018-11-29T00:00:00.000 | G15: 2653 | H15: =0.05*(RC[-6]+RC[4]+RC[3]+RC[2])+1.25 -> 44.478300500000003 | I15: =(8.38/100)*(RC[3]+RC[2]+RC[-7]) -> 72.450631638000019 | J15: 0 | K15: 37.598000000000006 | L15: 75.008010000000013
A16: 16 | B16: =R[14]C[3]+2001.1 -> 2001.1 | C16: 12 | D16: 10020 | E16: 16 | F16: 2018-08-24T00:00:00.000 | G16: 2766 | H16: =0.05*(RC[-6]+RC[4]+RC[3]+RC[2])+1.25 -> 116.28823624999998 | I16: =(8.38/100)*(RC[3]+RC[2]+RC[-7]) -> 192.80408395500004 | J16: 0 | K16: 100.05500000000001 | L16: 199.609725
A17: 17 | B17: =R[14]C[3]+461.97 -> 461.97 | C17: 12 | D17: 10020 | E17: 17 | F17: 2018-04-04T00:00:00.000 | G17: 3023 | H17: =0.05*(RC[-6]+RC[4]+RC[3]+RC[2])+1.25 -> 27.807500375000004 | I17: =(8.38/100)*(RC[3]+RC[2]+RC[-7]) -> 44.510370628500006 | J17: 0 | K17: 23.098500000000001 | L17: 46.081507500000008
A18: 18 | B18: 100 | C18: 20 | D18: 10025 | E18: 18 | F18: 2019-01-05T00:00:00.000 | G18: 4444 | H18: =0.05*(RC[-6]+RC[4]+RC[3]+RC[2])+1.25 -> 6.9987500000000002 | I18: =(8.38/100)*(RC[3]+RC[2]+RC[-7]) -> 9.6349050000000016 | J18: 0 | K18: 5 | L18: 9.9750000000000014

Sheet: PPVendeursClients
A1: 11 | B1: 10001 | C1: 2017-06-22T00:00:00.000
A2: 11 | B2: 10001 | C2: 2016-05-11T00:00:00.000
A3: 11 | B3: 10001 | C3: 2017-08-04T00:00:00.000
A4: 11 | B4: 10001 | C4: 2018-06-12T00:00:00.000
A5: 11 | B5: 10001 | C5: 2017-08-08T00:00:00.000
A6: 12 | B6: 10001 | C6: 2017-08-21T00:00:00.000
A7: 12 | B7: 10001 | C7: 2016-01-11T00:00:00.000
A8: 12 | B8: 10001 | C8: 2017-03-31T00:00:00.000
A9: 12 | B9: 10001 | C9: 2017-03-06T00:00:00.000
A10: 12 | B10: 10001 | C10: 2017-01-18T00:00:00.000
A11: 12 | B11: 10001 | C11: 2017-12-04T00:00:00.000
A12: 12 | B12: 10001 | C12: 2017-01-03T00:00:00.000
A13: 16 | B13: 10001 | C13: 2018-06-04T00:00:00.000
A14: 16 | B14: 10001 | C14: 2018-11-19T00:00:00.000
A15: 12 | B15: 10002 | C15: 2018-01-12T00:00:00.000
A16: 12 | B16: 10002 | C16: 2018-01-03T00:00:00.000
A17: 12 | B17: 10002 | C17: 2018-07-17T00:00:00.000
A18: 12 | B18: 10002 | C18: 2018-04-20T00:00:00.000
A19: 16 | B19: 10004 | C19: 2016-11-05T00:00:00.000
A20: 16 | B20: 10004 | C20: 2016-12-21T00:00:00.000
A21: 16 | B21: 10004 | C21: 2017-02-08T00:00:00.000
A22: 12 | B22: 10004 | C22: 2017-05-12T00:00:00.000
A23: 12 | B23: 10004 | C23: 2017-08-12T00:00:00.000
A24: 12 | B24: 10004 | C24: 2017-08-02T00:00:00.000
A25: 14 | B25: 10004 | C25: 2016-04-17T00:00:00.000
A26: 14 | B26: 10004 | C26: 2017-01-14T00:00:00.000
A27: 14 | B27: 10004 | C27: 2018-07-20T00:00:00.000
A28: 14 | B28: 10004 | C28: 2017-01-29T00:00:00.000
A29: 14 | B29: 10004 | C29: 2016-11-23T00:00:00.000
A30: 14 | B30: 10004 | C30: 2018-04-20T00:00:00.000
A31: 14 | B31: 10004 | C31: 2016-12-05T00:00:00.000
A32: 14 | B32: 10004 | C32: 2011-11-01T00:00:00.000
A33: 14 | B33: 10004 | C33: 2017-04-24T00:00:00.000
A34: 12 | B34: 10004 | C34: 2017-03-01T00:00:00.000
A35: 12 | B35: 10004 | C35: 2017-05-27T00:00:00.000
A36: 12 | B36: 10004 | C36: 2016-10-11T00:00:00.000
A37: 11 | B37: 10006 | C37: 2016-10-15T00:00:00.000
A38: 11 | B38: 10006 | C38: 2017-06-12T00:00:00.000
A39: 12 | B39: 10006 | C39: 2017-08-21T00:00:00.000
A40: 12 | B40: 10006 | C40: 2018-07-03T00:00:00.000
A41: 16 | B41: 10006 | C41: 2018-02-18T00:00:00.000
A42: 12 | B42: 10008 | C42: 2018-06-21T00:00:00.000
A43: 12 | B43: 10008 | C43: 2018-10-23T00:00:00.000
A44: 12 | B44: 10008 | C44: 2018-10-16T00:00:00.000
A45: 12 | B45: 10008 | C45: 2018-08-05T00:00:00.000
A46: 11 | B46: 10010 | C46: 2016-07-23T00:00:00.000
A47: 11 | B47: 10010 | C47: 2016-07-07T00:00:00.000
A48: 11 | B48: 10010 | C48: 2018-01-15T00:00:00.000
A49: 11 | B49: 10010 | C49: 2017-12-27T00:00:00.000
A50: 11 | B50: 10010 | C50: 2017-09-06T00:00:00.000
A51: 11 | B51: 10010 | C51: 2018-03-15T00:00:00.000
A52: 11 | B52: 10010 | C52: 2017-08-28T00:00:00.000
A53: 12 | B53: 10010 | C53: 2016-10-02T00:00:00.000
A54: 12 | B54: 10010 | C54: 2017-05-06T00:00:00.000
A55: 12 | B55: 10010 | C55: 2018-08-03T00:00:00.000
A56: 12 | B56: 10010 | C56: 2019-01-11T00:00:00.000
A57: 11 | B57: 10011 | C57: 2018-12-11T00:00:00.000
A58: 11 | B58: 10011 | C58: 2018-05-12T00:00:00.000
A59: 14 | B59: 10011 | C59: 2018-01-28T00:00:00.000
A60: 14 | B60: 10011 | C60: 2018-04-04T00:00:00.000
A61: 12 | B61: 10014 | C61: 2019-01-06T00:00:00.000
A62: 12 | B62: 10014 | C62: 2018-10-03T00:00:00.000
A63: 12 | B63: 10014 | C63: 2018-03-25T00:00:00.000
A64: 12 | B64: 10014 | C64: 2018-04-04T00:00:00.000
A65: 14 | B65: 10014 | C65: 2018-06-16T00:00:00.000
A66: 14 | B66: 10014 | C66: 2018-12-24T00:00:00.000
A67: 14 | B67: 10014 | C67: 2018-09-30T00:00:00.000
A68: 14 | B68: 10014 | C68: 2018-10-18T00:00:00.000
A69: 14 | B69: 10014 | C69: 2018-12-17T00:00:00.000
A70: 14 | B70: 10014 | C70: 2018-10-30T00:00:00.000
A71: 16 | B71: 10014 | C71: 2018-09-12T00:00:00.000
A72: 16 | B72: 10014 | C72: 2018-06-27T00:00:00.000
A73: 16 | B73: 10014 | C73: 2018-05-03T00:00:00.000
A74: 16 | B74: 10014 | C74: 2018-08-05T00:00:00.000
A75: 16 | B75: 10014 | C75: 2018-10-14T00:00:00.000
A76: 16 | B76: 10014 | C76: 2018-02-04T00:00:00.000
A77: 16 | B77: 10014 | C77: 2018-07-13T00:00:00.000
A78: 11 | B78: 10015 | C78: 2017-05-05T00:00:00.000
A79: 11 | B79: 10015 | C79: 2016-12-04T00:00:00.000
A80: 11 | B80: 10015 | C80: 2018-09-23T00:00:00.000
A81: 11 | B81: 10015 | C81: 2017-06-15T00:00:00.000
A82: 12 | B82: 10015 | C82: 2017-03-22T00:00:00.000
A83: 14 | B83: 10015 | C83: 2018-08-31T00:00:00.000
A84: 14 | B84: 10015 | C84: 2017-10-04T00:00:00.000
A85: 14 | B85: 10015 | C85: 2016-11-11T00:00:00.000
A86: 16 | B86: 10015 | C86: 2017-11-12T00:00:00.000
A87: 16 | B87: 10015 | C87: 2016-11-22T00:00:00.000
A88: 12 | B88: 10016 | C88: 2018-03-09T00:00:00.000
A89: 12 | B89: 10016 | C89: 2018-07-07T00:00:00.000
A90: 12 | B90: 10016 | C90: 2018-11-04T00:00:00.000
A91: 11 | B91: 10017 | C91: 2017-12-31T00:00:00.000
A92: 11 | B92: 10017 | C92: 2018-12-27T00:00:00.000
A93: 14 | B93: 10017 | C93: 2018-06-24T00:00:00.000
A94: 14 | B94: 10017 | C94: 2018-02-20T00:00:00.000
A95: 14 | B95: 10017 | C95: 2017-09-08T00:00:00.000
A96: 12 | B96: 10018 | C96: 2018-03-07T00:00:00.000
A97: 12 | B97: 10018 | C97: 2018-04-21T00:00:00.000
A98: 12 | B98: 10018 | C98: 2018-11-04T00:00:00.000
A99: 12 | B99: 10018 | C99: 2018-01-22T00:00:00.000
A100: 12 | B100: 10018 | C100: 2018-04-28T00:00:00.000
A101: 12 | B101: 10019 | C101: 2017-05-19T00:00:00.000
A102: 12 | B102: 10019 | C102: 2017-10-27T00:00:00.000
A103: 12 | B103: 10019 | C103: 2017-04-20T00:00:00.000
A104: 12 | B104: 10019 | C104: 2018-06-16T00:00:00.000
A105: 12 | B105: 10019 | C105: 2018-07-18T00:00:00.000
A106: 12 | B106: 10019 | C106: 2015-10-15T00:00:00.000
A107: 12 | B107: 10019 | C107: 2017-05-09T00:00:00.000
A108: 12 | B108: 10019 | C108: 2015-10-23T00:00:00.000
A109: 12 | B109: 10019 | C109: 2016-05-03T00:00:00.000
A110: 14 | B110: 10019 | C110: 2018-03-14T00:00:00.000
A111: 14 | B111: 10019 | C111: 2016-11-09T00:00:00.000
A112: 14 | B112: 10019 | C112: 2018-04-14T00:00:00.000
A113: 14 | B113: 10019 | C113: 2016-09-23T00:00:00.000
A114: 12 | B114: 10020 | C114: 2018-03-07T00:00:00.000
A115: 12 | B115: 10020 | C115: 2017-12-08T00:00:00.000
A116: 12 | B116: 10020 | C116: 2017-06-10T00:00:00.000
A117: 12 | B117: 10020 | C117: 2018-05-10T00:00:00.000
A118: 12 | B118: 10020 | C118: 2017-08-28T00:00:00.000
A119: 12 | B119: 10020 | C119: 2018-05-29T00:00:00.000
A120: 12 | B120: 10020 | C120: 2017-12-24T00:00:00.000
A121: 16 | B121: 10020 | C121: 2018-03-09T00:00:00.000
A122: 16 | B122: 10020 | C122: 2017-09-07T00:00:00.000
A123: 16 | B123: 10020 | C123: 2018-02-25T00:00:00.000
A124: 16 | B124: 10020 | C124: 2017-11-01T00:00:00.000
A125: 16 | B125: 10020 | C125: 2017-10-31T00:00:00.000
A126: 16 | B126: 10020 | C126: 2018-05-06T00:00:00.000

Sheet: PPTaxeProvinciale
A1: 10 | B1: 2005-01-01T00:00:00.000 | C1: 7.5
A2: 20 | B2: 2011-01-01T00:00:00.000 | C2: 8.5
A3: 30 | B3: 2012-01-01T00:00:00.000 | C3: 9.5
A4: 40 | B4: 2013-01-01T00:00:00.000 | C4: 9.9749999999999996

Sheet: PPGestionnaires
A1: 1 | B1: admin@cgodin.qc.ca | C1: Password1 | D1: 2018-06-18T00:00:00.000 | E1: Louis-Marie | F1: Brousseau
A2: 2 | B2: pl@gmail.com | C2: 1234 | D2: 2019-02-22T00:00:00.000 | E2: Pierre | F2: Lacasse

Sheet: PPTaxeFederale
A1: 10 | B1: 2001-01-01T00:00:00.000 | C1: 7
A2: 20 | B2: 2005-01-01T00:00:00.000 | C2: 6
A3: 30 | B3: 2008-01-01T00:00:00.000 | C3: 5